{"bitrix_id":"6504","ts":"2025-10-07T16:19:00+03:00","response":{"success":true,"message":"Contract successfully updated in Alma","alma_id":6621,"method":"PATCH","operation":"updated","data":{"id":6621,"name":"Contract_Sevgi__Un. 452.1 \/ Elite Residence,  apt. 3008_10.10.2025","number":"","start_date":"2025-10-10T00:00:00","end_date":"2025-11-10T00:00:00","external_id":"6504","created_at":"2025-10-07T12:20:29.893850Z","updated_at":"2025-10-07T13:19:00.779215Z","unit_usage":{"usage_id":17870,"client_id":13246,"unit_id":5533,"client_type":"tenant","is_archived":false},"price":"5699.00","contract_scan":null,"co_tenant":"","co_tenant_id_scan":null,"history":"","type_contract":"Short term from 1 to 3 months","co_tenant_id":""}}}
{"bitrix_id":"6502","ts":"2025-10-07T16:19:02+03:00","response":{"success":true,"message":"Contract successfully updated in Alma","alma_id":6618,"method":"PATCH","operation":"updated","data":{"id":6618,"name":"Contract_Anastasiia_Bastrakova_Un. 369.1 \/ The Residence at Marina Gate 2, apt. 3707_02.10.2025","number":"","start_date":"2025-07-26T00:00:00","end_date":"2026-10-02T00:00:00","external_id":"6502","created_at":"2025-10-07T10:00:53.623812Z","updated_at":"2025-10-07T13:19:02.690472Z","unit_usage":{"usage_id":17867,"client_id":12457,"unit_id":1678,"client_type":"tenant","is_archived":false},"price":"15000.00","contract_scan":null,"co_tenant":"","co_tenant_id_scan":null,"history":"1. Contract from 26.07.2025 to 02.10.2026","type_contract":"Short term from 1 to 3 months","co_tenant_id":""}}}
{"bitrix_id":"6500","ts":"2025-10-07T16:19:04+03:00","response":{"success":true,"message":"Contract successfully updated in Alma","alma_id":6609,"method":"PATCH","operation":"updated","data":{"id":6609,"name":"Contract_Samantha_Obama_Un. 60.2-2 \/ Up tower, apt. 2306_07.10.2025","number":"","start_date":"2025-10-07T00:00:00","end_date":"2025-11-07T00:00:00","external_id":"6500","created_at":"2025-10-06T19:06:12.272450Z","updated_at":"2025-10-07T13:19:04.618147Z","unit_usage":{"usage_id":17855,"client_id":13240,"unit_id":2331,"client_type":"tenant","is_archived":false},"price":"2599.00","contract_scan":null,"co_tenant":"","co_tenant_id_scan":null,"history":"1. Contract from 07.10.2025 to 07.11.2025","type_contract":"Short term from 1 to 3 months","co_tenant_id":""}}}
{"bitrix_id":"6498","ts":"2025-10-07T16:19:06+03:00","response":{"success":true,"message":"Contract successfully updated in Alma","alma_id":6610,"method":"PATCH","operation":"updated","data":{"id":6610,"name":"Contract_Lea_Moutonnet_Un. 231.1 \/ Jumeirah Bay Tower X1-1, apt. 605_13.10.2025","number":"","start_date":"2025-10-13T00:00:00","end_date":"2025-11-13T00:00:00","external_id":"6498","created_at":"2025-10-06T19:09:03.258559Z","updated_at":"2025-10-07T13:19:06.376891Z","unit_usage":{"usage_id":17856,"client_id":13239,"unit_id":1776,"client_type":"tenant","is_archived":false},"price":"0.00","contract_scan":null,"co_tenant":"","co_tenant_id_scan":null,"history":"","type_contract":"Short term from 1 to 3 months","co_tenant_id":""}}}
{"bitrix_id":"6496","ts":"2025-10-07T16:19:08+03:00","response":{"success":true,"message":"Contract successfully updated in Alma","alma_id":6608,"method":"PATCH","operation":"updated","data":{"id":6608,"name":"Contract_\u042e\u0440\u0438\u0439_Zubtsov_Un. 61.1 \/ Park Point, Block B, apt. 513_28.09.2025","number":"","start_date":"2024-09-28T00:00:00","end_date":"2025-12-28T00:00:00","external_id":"6496","created_at":"2025-10-06T16:11:21.914182Z","updated_at":"2025-10-07T13:19:08.190577Z","unit_usage":{"usage_id":17854,"client_id":11762,"unit_id":1942,"client_type":"tenant","is_archived":false},"price":"17700.00","contract_scan":null,"co_tenant":"","co_tenant_id_scan":null,"history":"1. Contract from 28.09.2024 to 28.12.2025","type_contract":"Short term from 1 to 3 months","co_tenant_id":""}}}
{"bitrix_id":"6494","ts":"2025-10-07T16:19:09+03:00","response":{"success":true,"message":"Contract successfully updated in Alma","alma_id":6607,"method":"PATCH","operation":"updated","data":{"id":6607,"name":"Contract_Ryan_Griesel_Un. 2.3 \/ Marina Wharf 2, apt. 1701_30.09.2025","number":"","start_date":"2025-07-31T00:00:00","end_date":"2025-10-30T00:00:00","external_id":"6494","created_at":"2025-10-06T16:08:09.327156Z","updated_at":"2025-10-07T13:19:09.909803Z","unit_usage":{"usage_id":17853,"client_id":12368,"unit_id":2310,"client_type":"tenant","is_archived":false},"price":"3500.00","contract_scan":null,"co_tenant":"","co_tenant_id_scan":null,"history":"","type_contract":"Less than a month","co_tenant_id":""}}}
{"bitrix_id":"6492","ts":"2025-10-07T16:19:11+03:00","response":{"success":true,"message":"Contract successfully created in Alma","alma_id":6626,"method":"POST","operation":"created","data":{"id":6626,"name":"Contract_Anton_Zolotarev*_Un. 289.1 \/ Park Ridge Tower C, apt. 1601_30.09.2025","number":"","start_date":"2025-07-30T00:00:00","end_date":"2026-09-30T00:00:00","external_id":"6492","created_at":"2025-10-07T13:19:11.634903Z","updated_at":"2025-10-07T13:19:11.647891Z","unit_usage":{"usage_id":17875,"client_id":12222,"unit_id":1710,"client_type":"tenant","is_archived":false},"price":"14000.00","contract_scan":null,"co_tenant":"","co_tenant_id_scan":null,"history":"1. Contract from 30.07.2025 to 30.09.2026","type_contract":"Short term from 1 to 3 months","co_tenant_id":""}}}
{"bitrix_id":"6490","ts":"2025-10-07T16:19:13+03:00","response":{"success":true,"message":"Contract successfully updated in Alma","alma_id":6603,"method":"PATCH","operation":"updated","data":{"id":6603,"name":"Contract_Emil_Rustamov_Un. 987.1 \/ TEST TEST, apt. 00_06.10.2025","number":"","start_date":"2025-10-07T00:00:00","end_date":"2025-10-27T00:00:00","external_id":"6490","created_at":"2025-10-06T12:39:11.706413Z","updated_at":"2025-10-07T13:19:13.320190Z","unit_usage":{"usage_id":17849,"client_id":12733,"unit_id":15414,"client_type":"tenant","is_archived":false},"price":"1.00","contract_scan":null,"co_tenant":"","co_tenant_id_scan":null,"history":"","type_contract":"Short term from 1 to 3 months","co_tenant_id":""}}}
{"bitrix_id":"6486","ts":"2025-10-07T16:19:14+03:00","response":{"success":true,"message":"Contract successfully created in Alma","alma_id":6627,"method":"POST","operation":"created","data":{"id":6627,"name":"Contract_Gordeeva_Veronika_Un. 600.1 \/ Time Place Tower, apt. 1608_15.10.2025","number":"","start_date":"2025-09-30T00:00:00","end_date":"2025-10-11T00:00:00","external_id":"6486","created_at":"2025-10-07T13:19:14.973147Z","updated_at":"2025-10-07T13:19:14.982609Z","unit_usage":{"usage_id":17876,"client_id":12969,"unit_id":15174,"client_type":"tenant","is_archived":false},"price":"14700.00","contract_scan":null,"co_tenant":"","co_tenant_id_scan":null,"history":"","type_contract":"Short contract up to 1 month","co_tenant_id":""}}}
{"bitrix_id":"6484","ts":"2025-10-07T16:19:16+03:00","response":{"success":true,"message":"Contract successfully updated in Alma","alma_id":6599,"method":"PATCH","operation":"updated","data":{"id":6599,"name":"Contract_Olga_Lebedeva_Un. 55.1 \/ Princess tower 6.10.2025","number":"","start_date":"2025-10-16T00:00:00","end_date":"2025-11-16T00:00:00","external_id":"6484","created_at":"2025-10-06T10:19:45.878369Z","updated_at":"2025-10-07T13:19:16.680971Z","unit_usage":{"usage_id":17841,"client_id":13232,"unit_id":1940,"client_type":"tenant","is_archived":false},"price":"11900.00","contract_scan":null,"co_tenant":"","co_tenant_id_scan":null,"history":"","type_contract":"Short contract up to 1 month","co_tenant_id":""}}}
{"bitrix_id":"6482","ts":"2025-10-07T16:19:18+03:00","response":{"success":true,"message":"Contract successfully updated in Alma","alma_id":6592,"method":"PATCH","operation":"updated","data":{"id":6592,"name":"Contract_Omair_Pasha Hafiz Ahmed Pasha_Un. 114.1 \/ Prime Views,  apt. 339_23.09.2025","number":"","start_date":"2025-06-23T00:00:00","end_date":"2025-10-23T00:00:00","external_id":"6482","created_at":"2025-10-06T08:23:31.671347Z","updated_at":"2025-10-07T13:19:18.398287Z","unit_usage":{"usage_id":17832,"client_id":12061,"unit_id":1888,"client_type":"tenant","is_archived":false},"price":"6365.00","contract_scan":null,"co_tenant":"","co_tenant_id_scan":null,"history":"","type_contract":"Short term from 1 to 3 months","co_tenant_id":""}}}
{"bitrix_id":"6480","ts":"2025-10-07T16:19:20+03:00","response":{"success":true,"message":"Contract successfully updated in Alma","alma_id":6587,"method":"PATCH","operation":"updated","data":{"id":6587,"name":"Contract_Callum_John Mulrainey_Un. 442.1 \/ Binghatti Corner, apt. 1808_05.10.2025","number":"","start_date":"2025-10-05T00:00:00","end_date":"2025-11-05T00:00:00","external_id":"6480","created_at":"2025-10-06T07:18:07.903948Z","updated_at":"2025-10-07T13:19:20.140363Z","unit_usage":{"usage_id":17823,"client_id":12863,"unit_id":4675,"client_type":"tenant","is_archived":false},"price":"7400.00","contract_scan":null,"co_tenant":"","co_tenant_id_scan":null,"history":"","type_contract":"Short term from 1 to 3 months","co_tenant_id":""}}}
{"bitrix_id":"6478","ts":"2025-10-07T16:19:22+03:00","response":{"success":true,"message":"Contract successfully updated in Alma","alma_id":6586,"method":"PATCH","operation":"updated","data":{"id":6586,"name":"Contract_Bassel_Wannous_Un. 111.1 \/ Lake View tower, apt. 605_15.10.2025","number":"","start_date":"2025-08-15T00:00:00","end_date":"2025-11-02T00:00:00","external_id":"6478","created_at":"2025-10-06T07:13:00.123265Z","updated_at":"2025-10-07T13:19:22.028441Z","unit_usage":{"usage_id":17822,"client_id":12587,"unit_id":1894,"client_type":"tenant","is_archived":false},"price":"6199.00","contract_scan":null,"co_tenant":"","co_tenant_id_scan":null,"history":"","type_contract":"Short term from 1 to 3 months","co_tenant_id":""}}}
{"bitrix_id":"6476","ts":"2025-10-07T16:19:23+03:00","response":[2025-10-07 13:19:23] [ERROR] Failed to create contract: API request failed (400): {&quot;non_field_errors&quot;:[&quot;There are intersections in the use of the unit. Nearest intersection usage id:16693 usage type=tenant.&quot;]}<br>
[2025-10-07 13:19:23] [ERROR] Unexpected error in contract synchronization: Contract synchronization failed: API request failed (400): {&quot;non_field_errors&quot;:[&quot;There are intersections in the use of the unit. Nearest intersection usage id:16693 usage type=tenant.&quot;]}<br>
{"success":false,"message":"Unexpected error: Contract synchronization failed"}}
{"bitrix_id":"6474","ts":"2025-10-07T16:19:25+03:00","response":[2025-10-07 13:19:25] [ERROR] Failed to create contract: API request failed (400): {&quot;non_field_errors&quot;:[&quot;There are intersections in the use of the unit. Nearest intersection usage id:16693 usage type=tenant.&quot;]}<br>
[2025-10-07 13:19:25] [ERROR] Unexpected error in contract synchronization: Contract synchronization failed: API request failed (400): {&quot;non_field_errors&quot;:[&quot;There are intersections in the use of the unit. Nearest intersection usage id:16693 usage type=tenant.&quot;]}<br>
{"success":false,"message":"Unexpected error: Contract synchronization failed"}}
{"bitrix_id":"6472","ts":"2025-10-07T16:19:27+03:00","response":{"success":true,"message":"Contract successfully updated in Alma","alma_id":6578,"method":"PATCH","operation":"updated","data":{"id":6578,"name":"Contract_Sam_Tumkaew_Un. 189.1 \/ Creek Edge tower 1, apt. 305_15.10.2025","number":"","start_date":"2025-10-15T00:00:00","end_date":"2025-11-01T00:00:00","external_id":"6472","created_at":"2025-10-06T06:00:56.068341Z","updated_at":"2025-10-07T13:19:27.303561Z","unit_usage":{"usage_id":17812,"client_id":13222,"unit_id":1809,"client_type":"tenant","is_archived":false},"price":"7400.00","contract_scan":null,"co_tenant":"","co_tenant_id_scan":null,"history":"","type_contract":"Less than a month","co_tenant_id":""}}}
{"bitrix_id":"6470","ts":"2025-10-07T16:19:29+03:00","response":{"success":true,"message":"Contract successfully updated in Alma","alma_id":6614,"method":"PATCH","operation":"updated","data":{"id":6614,"name":"Contract_ANASTASIA_TZEVELEKOU_Un. 538.1 \/ Marina Star, apt. S1101_06.10.2025","number":"","start_date":"2025-10-06T00:00:00","end_date":"2025-11-06T00:00:00","external_id":"6470","created_at":"2025-10-07T06:51:59.619062Z","updated_at":"2025-10-07T13:19:28.999290Z","unit_usage":{"usage_id":17863,"client_id":13216,"unit_id":9306,"client_type":"tenant","is_archived":false},"price":"11500.00","contract_scan":null,"co_tenant":"","co_tenant_id_scan":null,"history":"","type_contract":"Short term from 1 to 3 months","co_tenant_id":""}}}
{"bitrix_id":"6468","ts":"2025-10-07T16:19:30+03:00","response":{"success":true,"message":"Contract successfully updated in Alma","alma_id":6575,"method":"PATCH","operation":"updated","data":{"id":6575,"name":"Contract_Christopher_White_Un. 527.1 \/ Damac Hills Carson B, apt. 2012_05.10.2025","number":"","start_date":"2025-10-05T00:00:00","end_date":"2025-11-05T00:00:00","external_id":"6468","created_at":"2025-10-05T14:16:05.334681Z","updated_at":"2025-10-07T13:19:30.631254Z","unit_usage":{"usage_id":17809,"client_id":12701,"unit_id":5559,"client_type":"tenant","is_archived":false},"price":"8500.00","contract_scan":null,"co_tenant":"","co_tenant_id_scan":null,"history":"1. Contract from 05.10.2025 to 05.11.2025","type_contract":"Short term from 1 to 3 months","co_tenant_id":""}}}
{"bitrix_id":"6466","ts":"2025-10-07T16:19:32+03:00","response":{"success":true,"message":"Contract successfully updated in Alma","alma_id":6576,"method":"PATCH","operation":"updated","data":{"id":6576,"name":"Contract_No name_name_Un. 642.1 \/ 52|42, apt. 2903_08.10.2025","number":"","start_date":"2025-10-08T00:00:00","end_date":"2025-11-08T00:00:00","external_id":"6466","created_at":"2025-10-05T19:05:42.605956Z","updated_at":"2025-10-07T13:19:32.243697Z","unit_usage":{"usage_id":17810,"client_id":13212,"unit_id":15305,"client_type":"tenant","is_archived":false},"price":"0.00","contract_scan":null,"co_tenant":"","co_tenant_id_scan":null,"history":"","type_contract":"Short term from 1 to 3 months","co_tenant_id":""}}}
{"bitrix_id":"6456","ts":"2025-10-07T16:19:33+03:00","response":{"success":true,"message":"Contract successfully updated in Alma","alma_id":6573,"method":"PATCH","operation":"updated","data":{"id":6573,"name":"Contract_Nikita_Chursin_Un. 621.1 \/ Bloom Towers C, apt. C-0702_09.10.2025","number":"","start_date":"2025-10-09T00:00:00","end_date":"2025-11-09T00:00:00","external_id":"6456","created_at":"2025-10-05T11:53:19.180082Z","updated_at":"2025-10-07T13:19:33.926607Z","unit_usage":{"usage_id":17807,"client_id":13209,"unit_id":15198,"client_type":"tenant","is_archived":false},"price":"9000.00","contract_scan":null,"co_tenant":"","co_tenant_id_scan":null,"history":"","type_contract":"Short term from 1 to 3 months","co_tenant_id":""}}}
{"bitrix_id":"6454","ts":"2025-10-07T16:19:35+03:00","response":{"success":true,"message":"Contract successfully updated in Alma","alma_id":6572,"method":"PATCH","operation":"updated","data":{"id":6572,"name":"Contract_Wassim_Tawil_Un. 154.1 \/ Zada Tower, apt. 1214_07.10.2025","number":"","start_date":"2025-10-07T00:00:00","end_date":"2025-12-07T00:00:00","external_id":"6454","created_at":"2025-10-05T11:02:13.241395Z","updated_at":"2025-10-07T13:19:35.585823Z","unit_usage":{"usage_id":17806,"client_id":13207,"unit_id":1852,"client_type":"tenant","is_archived":false},"price":"0.00","contract_scan":null,"co_tenant":"","co_tenant_id_scan":null,"history":"","type_contract":"Short term from 1 to 3 months","co_tenant_id":""}}}
{"bitrix_id":"6452","ts":"2025-10-07T16:19:37+03:00","response":{"success":true,"message":"Contract successfully updated in Alma","alma_id":6571,"method":"PATCH","operation":"updated","data":{"id":6571,"name":"Contract_Danylo_Matukhno_Un. 570.1 \/ Lotus at Creek Beach Building 3, apt. 906_07.10.2025","number":"","start_date":"2025-10-07T00:00:00","end_date":"2025-11-07T00:00:00","external_id":"6452","created_at":"2025-10-05T10:26:34.927177Z","updated_at":"2025-10-07T13:19:37.307594Z","unit_usage":{"usage_id":17805,"client_id":13205,"unit_id":14998,"client_type":"tenant","is_archived":false},"price":"19000.00","contract_scan":null,"co_tenant":"","co_tenant_id_scan":null,"history":"","type_contract":"Short term from 1 to 3 months","co_tenant_id":""}}}
{"bitrix_id":"6450","ts":"2025-10-07T16:19:38+03:00","response":{"success":true,"message":"Contract successfully updated in Alma","alma_id":6574,"method":"PATCH","operation":"updated","data":{"id":6574,"name":"Contract_Max_Y_Un. 30.4 \/ Rimal 6, apt. 2\/201_05.10.2025","number":"","start_date":"2025-10-05T00:00:00","end_date":"2025-11-05T00:00:00","external_id":"6450","created_at":"2025-10-05T13:39:47.302950Z","updated_at":"2025-10-07T13:19:38.950399Z","unit_usage":{"usage_id":17808,"client_id":13203,"unit_id":2345,"client_type":"tenant","is_archived":false},"price":"5599.00","contract_scan":null,"co_tenant":"","co_tenant_id_scan":null,"history":"1. Contract from 05.10.2025 to 05.11.2025","type_contract":"Short term from 1 to 3 months","co_tenant_id":""}}}
{"bitrix_id":"6448","ts":"2025-10-07T16:19:40+03:00","response":{"success":true,"message":"Contract successfully created in Alma","alma_id":6628,"method":"POST","operation":"created","data":{"id":6628,"name":"Contract_Ahmad Ibrahim_Darwish_Un. 38.1 \/ Al Arta 1, apt. 216_04.10.2025","number":"","start_date":"2025-08-04T00:00:00","end_date":"2025-10-11T00:00:00","external_id":"6448","created_at":"2025-10-07T13:19:40.549737Z","updated_at":"2025-10-07T13:19:40.560861Z","unit_usage":{"usage_id":17877,"client_id":9931,"unit_id":1964,"client_type":"tenant","is_archived":false},"price":"7400.00","contract_scan":null,"co_tenant":"","co_tenant_id_scan":null,"history":"","type_contract":"Short term from 1 to 3 months","co_tenant_id":""}}}
{"bitrix_id":"6446","ts":"2025-10-07T16:19:42+03:00","response":[2025-10-07 13:19:42] [ERROR] Unexpected error in contract synchronization: Contract synchronization failed: API request failed (400): {&quot;non_field_errors&quot;:[&quot;There are intersections in the use of the unit. Nearest intersection usage id:17796 usage type=tenant.&quot;]}<br>
{"success":false,"message":"Unexpected error: Contract synchronization failed"}}
{"bitrix_id":"6444","ts":"2025-10-07T16:19:43+03:00","response":{"success":true,"message":"Contract successfully updated in Alma","alma_id":6565,"method":"PATCH","operation":"updated","data":{"id":6565,"name":"Contract_Yuliya Goldman_Goldman_Un. 667.1 \/ Grand Bleu Tower interiors by Elie Saab Tower 2, apt. 2403_08.10.2025","number":"","start_date":"2025-10-08T00:00:00","end_date":"2025-11-08T00:00:00","external_id":"6444","created_at":"2025-10-04T16:36:55.468730Z","updated_at":"2025-10-07T13:19:43.677155Z","unit_usage":{"usage_id":17798,"client_id":13197,"unit_id":15420,"client_type":"tenant","is_archived":false},"price":"22999.00","contract_scan":null,"co_tenant":"","co_tenant_id_scan":null,"history":"","type_contract":"Short contract up to 1 month","co_tenant_id":""}}}
{"bitrix_id":"6442","ts":"2025-10-07T16:19:45+03:00","response":[2025-10-07 13:19:45] [ERROR] Failed to create contract: API request failed (400): {&quot;non_field_errors&quot;:[&quot;There are intersections in the use of the unit. Nearest intersection usage id:15772 usage type=tenant.&quot;]}<br>
[2025-10-07 13:19:45] [ERROR] Unexpected error in contract synchronization: Contract synchronization failed: API request failed (400): {&quot;non_field_errors&quot;:[&quot;There are intersections in the use of the unit. Nearest intersection usage id:15772 usage type=tenant.&quot;]}<br>
{"success":false,"message":"Unexpected error: Contract synchronization failed"}}
{"bitrix_id":"6440","ts":"2025-10-07T16:19:46+03:00","response":[2025-10-07 13:19:46] [ERROR] Contract synchronization failed: Object not found in Alma for Bitrix ID: 1120<br>
[2025-10-07 13:19:46] [ERROR] Unexpected error in contract synchronization: Contract synchronization failed: Object not found in Alma for Bitrix ID: 1120<br>
{"success":false,"message":"Unexpected error: Contract synchronization failed"}}
{"bitrix_id":"6436","ts":"2025-10-07T16:19:47+03:00","response":{"success":true,"message":"Contract successfully updated in Alma","alma_id":6561,"method":"PATCH","operation":"updated","data":{"id":6561,"name":"Contract_Konstantin_Kulikov_Un. 494.1 \/ Socio Tower 2, apt. 109_11.10.2025","number":"","start_date":"2025-10-11T00:00:00","end_date":"2025-10-25T00:00:00","external_id":"6436","created_at":"2025-10-04T10:43:34.359473Z","updated_at":"2025-10-07T13:19:47.815150Z","unit_usage":{"usage_id":17794,"client_id":13191,"unit_id":5481,"client_type":"tenant","is_archived":false},"price":"0.00","contract_scan":null,"co_tenant":"","co_tenant_id_scan":null,"history":"","type_contract":"Short contract up to 1 month","co_tenant_id":""}}}
{"bitrix_id":"6434","ts":"2025-10-07T16:19:49+03:00","response":{"success":true,"message":"Contract successfully updated in Alma","alma_id":6582,"method":"PATCH","operation":"updated","data":{"id":6582,"name":"Contract_Alex_Kedrov_Un. 2.2 \/ Marina Wharf 2, apt. 1701_05.10.2025","number":"","start_date":"2025-10-05T00:00:00","end_date":"2025-11-01T00:00:00","external_id":"6434","created_at":"2025-10-06T06:22:58.049320Z","updated_at":"2025-10-07T13:19:49.693875Z","unit_usage":{"usage_id":17818,"client_id":13187,"unit_id":2299,"client_type":"tenant","is_archived":false},"price":"5604.00","contract_scan":null,"co_tenant":"","co_tenant_id_scan":null,"history":"","type_contract":"Short term from 1 to 3 months","co_tenant_id":""}}}
{"bitrix_id":"6432","ts":"2025-10-07T16:19:51+03:00","response":{"success":true,"message":"Contract successfully updated in Alma","alma_id":6615,"method":"PATCH","operation":"updated","data":{"id":6615,"name":"Contract_Charlie_Peter_Un. 468.1 \/ Mag 545, apt. 314_10.10.2025","number":"","start_date":"2025-10-10T00:00:00","end_date":"2025-11-10T00:00:00","external_id":"6432","created_at":"2025-10-07T06:59:11.034975Z","updated_at":"2025-10-07T13:19:51.316322Z","unit_usage":{"usage_id":17864,"client_id":13186,"unit_id":5400,"client_type":"tenant","is_archived":false},"price":"11000.00","contract_scan":null,"co_tenant":"","co_tenant_id_scan":null,"history":"","type_contract":"Short term from 1 to 3 months","co_tenant_id":""}}}
{"bitrix_id":"6430","ts":"2025-10-07T16:19:52+03:00","response":{"success":true,"message":"Contract successfully updated in Alma","alma_id":6625,"method":"PATCH","operation":"updated","data":{"id":6625,"name":"Contract_Mikhail_Vazin_Un. 717.1 \/ Liv Marina, apt. 2004_08.10.2025","number":"","start_date":"2025-10-08T00:00:00","end_date":"2025-11-14T00:00:00","external_id":"6430","created_at":"2025-10-07T13:13:25.368258Z","updated_at":"2025-10-07T13:19:52.919298Z","unit_usage":{"usage_id":17874,"client_id":13185,"unit_id":15412,"client_type":"tenant","is_archived":false},"price":"18905.00","contract_scan":null,"co_tenant":"","co_tenant_id_scan":null,"history":"","type_contract":"Short term from 1 to 3 months","co_tenant_id":""}}}
{"bitrix_id":"6428","ts":"2025-10-07T16:19:54+03:00","response":{"success":true,"message":"Contract successfully updated in Alma","alma_id":6562,"method":"PATCH","operation":"updated","data":{"id":6562,"name":"Contract_Sally_Weiss_Un. 560.1 \/  Socio Tower 1, apt.  419_04.10.2025","number":"","start_date":"2025-09-04T00:00:00","end_date":"2025-11-04T00:00:00","external_id":"6428","created_at":"2025-10-04T11:05:39.772916Z","updated_at":"2025-10-07T13:19:54.572359Z","unit_usage":{"usage_id":17795,"client_id":12870,"unit_id":15022,"client_type":"tenant","is_archived":false},"price":"8699.00","contract_scan":null,"co_tenant":"","co_tenant_id_scan":null,"history":"1. Contract from 04.09.2025 to 04.11.2025","type_contract":"Short term from 1 to 3 months","co_tenant_id":""}}}
{"bitrix_id":"6426","ts":"2025-10-07T16:19:56+03:00","response":{"success":true,"message":"Contract successfully updated in Alma","alma_id":6581,"method":"PATCH","operation":"updated","data":{"id":6581,"name":"Contract_Amirmahdi_Honardoost_Un. 514.1 \/ CONCEPT 7 RESIDENCES, apt. 204_04.10.2025","number":"","start_date":"2025-10-04T00:00:00","end_date":"2025-11-04T00:00:00","external_id":"6426","created_at":"2025-10-06T06:20:14.452909Z","updated_at":"2025-10-07T13:19:56.574083Z","unit_usage":{"usage_id":17816,"client_id":13184,"unit_id":14988,"client_type":"tenant","is_archived":false},"price":"10599.00","contract_scan":null,"co_tenant":"","co_tenant_id_scan":null,"history":"1. Contract from 04.10.2025 to 04.11.2025","type_contract":"Short term from 1 to 3 months","co_tenant_id":""}}}
{"bitrix_id":"6424","ts":"2025-10-07T16:19:58+03:00","response":{"success":true,"message":"Contract successfully updated in Alma","alma_id":6553,"method":"PATCH","operation":"updated","data":{"id":6553,"name":"Contract_Oksana_Pedan_Un. 518.1 \/ Sky View, apt. 2901_02.10.2025","number":"","start_date":"2025-10-02T00:00:00","end_date":"2026-10-02T00:00:00","external_id":"6424","created_at":"2025-10-03T12:11:50.596995Z","updated_at":"2025-10-07T13:19:58.314373Z","unit_usage":{"usage_id":17784,"client_id":11679,"unit_id":15410,"client_type":"tenant","is_archived":false},"price":"6800.00","contract_scan":null,"co_tenant":"","co_tenant_id_scan":null,"history":"1. Contract from 02.10.2025 to 02.10.2026","type_contract":"Long-term 3+ months","co_tenant_id":""}}}
{"bitrix_id":"6420","ts":"2025-10-07T16:20:01+03:00","response":{"success":true,"message":"Contract successfully updated in Alma","alma_id":6585,"method":"PATCH","operation":"updated","data":{"id":6585,"name":"Contract_Irene_Garcia Munguia_Un. 85.1 \/ Zada Tower, apt.214_09.10.2025","number":"","start_date":"2025-10-09T00:00:00","end_date":"2025-11-09T00:00:00","external_id":"6420","created_at":"2025-10-06T06:58:50.082815Z","updated_at":"2025-10-07T13:20:01.064306Z","unit_usage":{"usage_id":17821,"client_id":13177,"unit_id":1909,"client_type":"tenant","is_archived":false},"price":"10000.00","contract_scan":null,"co_tenant":"","co_tenant_id_scan":null,"history":"","type_contract":"Short term from 1 to 3 months","co_tenant_id":""}}}
{"bitrix_id":"6418","ts":"2025-10-07T16:20:03+03:00","response":{"success":true,"message":"Contract successfully updated in Alma","alma_id":6552,"method":"PATCH","operation":"updated","data":{"id":6552,"name":"Contract_Shivani_Srinivasan_Un. 9.2-2 \/ Up Tower, apt. 301_02.10.2025","number":"","start_date":"2025-04-02T00:00:00","end_date":"2026-07-02T00:00:00","external_id":"6418","created_at":"2025-10-03T11:41:45.988539Z","updated_at":"2025-10-07T13:20:03.108580Z","unit_usage":{"usage_id":17783,"client_id":11867,"unit_id":2379,"client_type":"tenant","is_archived":false},"price":"2800.00","contract_scan":null,"co_tenant":"","co_tenant_id_scan":null,"history":"1. Contract from 02.04.2025 to 02.07.2026","type_contract":"Long-term 3+ months","co_tenant_id":""}}}
{"bitrix_id":"6416","ts":"2025-10-07T16:20:04+03:00","response":{"success":true,"message":"Contract successfully updated in Alma","alma_id":6551,"method":"PATCH","operation":"updated","data":{"id":6551,"name":"Contract_Avnish_Sharma_Un. 53.1 \/ Reva Residences, apt. 617_27.09.2025","number":"","start_date":"2025-08-27T00:00:00","end_date":"2025-10-18T00:00:00","external_id":"6416","created_at":"2025-10-03T11:39:46.883362Z","updated_at":"2025-10-07T13:20:04.961307Z","unit_usage":{"usage_id":17782,"client_id":12689,"unit_id":1948,"client_type":"tenant","is_archived":false},"price":"7707.00","contract_scan":null,"co_tenant":"","co_tenant_id_scan":null,"history":"","type_contract":"Short term from 1 to 3 months","co_tenant_id":""}}}
{"bitrix_id":"6414","ts":"2025-10-07T16:20:11+03:00","response":{"success":true,"message":"Contract successfully updated in Alma","alma_id":6598,"method":"PATCH","operation":"updated","data":{"id":6598,"name":"Contract_Vitoria_Flavia_Un. 54.1 \/ Bellevue 1, apt. 1806B_04.10.2025","number":"","start_date":"2025-10-04T00:00:00","end_date":"2025-11-04T00:00:00","external_id":"6414","created_at":"2025-10-06T08:57:34.813980Z","updated_at":"2025-10-07T13:20:11.821074Z","unit_usage":{"usage_id":17840,"client_id":13176,"unit_id":1952,"client_type":"tenant","is_archived":false},"price":"12499.00","contract_scan":null,"co_tenant":"","co_tenant_id_scan":null,"history":"","type_contract":"Short term from 1 to 3 months","co_tenant_id":""}}}
{"bitrix_id":"6412","ts":"2025-10-07T16:20:13+03:00","response":{"success":true,"message":"Contract successfully updated in Alma","alma_id":6548,"method":"PATCH","operation":"updated","data":{"id":6548,"name":"Contract_Mohamed_Hamza Bentaleb_Un. 131.1 \/ O2 Residences, apt. 201_05.10.2025","number":"","start_date":"2025-09-03T00:00:00","end_date":"2025-11-05T00:00:00","external_id":"6412","created_at":"2025-10-03T10:59:08.392414Z","updated_at":"2025-10-07T13:20:13.572827Z","unit_usage":{"usage_id":17778,"client_id":12698,"unit_id":1870,"client_type":"tenant","is_archived":false},"price":"10999.00","contract_scan":null,"co_tenant":"","co_tenant_id_scan":null,"history":"1. Contract from 03.09.2025 to 05.11.2025","type_contract":"Short term from 1 to 3 months","co_tenant_id":""}}}
{"bitrix_id":"6410","ts":"2025-10-07T16:20:15+03:00","response":{"success":true,"message":"Contract successfully updated in Alma","alma_id":6593,"method":"PATCH","operation":"updated","data":{"id":6593,"name":"Contract_Shahmir_khan Chandio_Un. 59.1 \/ Up tower. apt. 2206_06.10.2025","number":"","start_date":"2025-10-06T00:00:00","end_date":"2025-11-06T00:00:00","external_id":"6410","created_at":"2025-10-06T08:30:09.814630Z","updated_at":"2025-10-07T13:20:15.298763Z","unit_usage":{"usage_id":17833,"client_id":13170,"unit_id":2333,"client_type":"tenant","is_archived":false},"price":"5700.00","contract_scan":null,"co_tenant":"","co_tenant_id_scan":null,"history":"1. Contract from 06.10.2025 to 06.11.2025","type_contract":"Short term from 1 to 3 months","co_tenant_id":""}}}
{"bitrix_id":"6408","ts":"2025-10-07T16:20:17+03:00","response":{"success":true,"message":"Contract successfully updated in Alma","alma_id":6543,"method":"PATCH","operation":"updated","data":{"id":6543,"name":"Contract_Lost lead for the call from 971585423278 by Callge__Un. 103.1 \/ Goldcrest Executive, apt. 2616_12.10.2025","number":"","start_date":"2025-10-12T00:00:00","end_date":"2026-01-12T00:00:00","external_id":"6408","created_at":"2025-10-03T08:42:20.403398Z","updated_at":"2025-10-07T13:20:17.062306Z","unit_usage":{"usage_id":17772,"client_id":13169,"unit_id":1902,"client_type":"tenant","is_archived":false},"price":"9399.00","contract_scan":null,"co_tenant":"","co_tenant_id_scan":null,"history":"","type_contract":"Short term from 1 to 3 months","co_tenant_id":""}}}
{"bitrix_id":"6404","ts":"2025-10-07T16:20:18+03:00","response":{"success":true,"message":"Contract successfully updated in Alma","alma_id":6537,"method":"PATCH","operation":"updated","data":{"id":6537,"name":"Contract_\u041c\u0430\u0440\u0438\u044f_Neshumova_Un. 70.1 \/ Botanica tower, apt. 2607_30.09.2025","number":"","start_date":"2024-10-01T00:00:00","end_date":"2026-09-30T00:00:00","external_id":"6404","created_at":"2025-10-02T17:05:28.616906Z","updated_at":"2025-10-07T13:20:18.849192Z","unit_usage":{"usage_id":17765,"client_id":2334,"unit_id":1935,"client_type":"tenant","is_archived":false},"price":"13000.00","contract_scan":null,"co_tenant":"","co_tenant_id_scan":null,"history":"1. Contract from 01.10.2024 to 30.09.2026","type_contract":"Long-term 3+ months","co_tenant_id":""}}}
{"bitrix_id":"6402","ts":"2025-10-07T16:20:20+03:00","response":{"success":true,"message":"Contract successfully updated in Alma","alma_id":6596,"method":"PATCH","operation":"updated","data":{"id":6596,"name":"Contract_Wono Yoo_Yoo_Un. 41.1 \/ Candace Acacia, apt. 1\/122_02.10.2025","number":"","start_date":"2025-10-14T00:00:00","end_date":"2026-10-14T00:00:00","external_id":"6402","created_at":"2025-10-06T08:46:45.128167Z","updated_at":"2025-10-07T13:20:20.790129Z","unit_usage":{"usage_id":17836,"client_id":13166,"unit_id":1959,"client_type":"tenant","is_archived":false},"price":"6999.00","contract_scan":null,"co_tenant":"","co_tenant_id_scan":null,"history":"","type_contract":"Long-term 3+ months","co_tenant_id":""}}}
{"bitrix_id":"6400","ts":"2025-10-07T16:20:22+03:00","response":{"success":true,"message":"Contract successfully updated in Alma","alma_id":6536,"method":"PATCH","operation":"updated","data":{"id":6536,"name":"Contract_\u0411\u043e\u0433\u0434\u0430\u043d__Un. 219.1 \/ Binghatti Nova, apt. 1010_02.10.2025","number":"","start_date":"2025-10-02T00:00:00","end_date":"2025-11-02T00:00:00","external_id":"6400","created_at":"2025-10-02T16:07:58.604561Z","updated_at":"2025-10-07T13:20:22.459371Z","unit_usage":{"usage_id":17764,"client_id":13165,"unit_id":1777,"client_type":"tenant","is_archived":false},"price":"9000.00","contract_scan":null,"co_tenant":"","co_tenant_id_scan":null,"history":"","type_contract":"Short term from 1 to 3 months","co_tenant_id":""}}}
{"bitrix_id":"6398","ts":"2025-10-07T16:20:24+03:00","response":{"success":true,"message":"Contract successfully updated in Alma","alma_id":6532,"method":"PATCH","operation":"updated","data":{"id":6532,"name":"Contract_Giovana Zamith_Zamith_Un. 69.1 \/ Park Central, apt. 1405_14.10.2025","number":"","start_date":"2025-10-14T00:00:00","end_date":"2025-11-14T00:00:00","external_id":"6398","created_at":"2025-10-02T13:04:43.003733Z","updated_at":"2025-10-07T13:20:24.111446Z","unit_usage":{"usage_id":17760,"client_id":13164,"unit_id":1929,"client_type":"tenant","is_archived":false},"price":"7999.00","contract_scan":null,"co_tenant":"","co_tenant_id_scan":null,"history":"","type_contract":"Short term from 1 to 3 months","co_tenant_id":""}}}
{"bitrix_id":"6390","ts":"2025-10-07T16:20:25+03:00","response":{"success":true,"message":"Contract successfully updated in Alma","alma_id":6529,"method":"PATCH","operation":"updated","data":{"id":6529,"name":"Contract_Nika__Un. 344.1 \/ Ocean Heights, apt. 11A09_20.10.2025","number":"","start_date":"2025-10-20T00:00:00","end_date":"2026-01-20T00:00:00","external_id":"6390","created_at":"2025-10-02T11:51:00.853352Z","updated_at":"2025-10-07T13:20:25.976894Z","unit_usage":{"usage_id":17757,"client_id":13162,"unit_id":1682,"client_type":"tenant","is_archived":false},"price":"0.00","contract_scan":null,"co_tenant":"","co_tenant_id_scan":null,"history":"","type_contract":"Short term from 1 to 3 months","co_tenant_id":""}}}
{"bitrix_id":"6388","ts":"2025-10-07T16:20:27+03:00","response":{"success":true,"message":"Contract successfully updated in Alma","alma_id":6600,"method":"PATCH","operation":"updated","data":{"id":6600,"name":"Contract_Valeria_Elizarova_Un. 441.1 \/ MBL Royal, apt. 1902_02.03.2026","number":"","start_date":"2025-09-03T00:00:00","end_date":"2026-09-02T00:00:00","external_id":"6388","created_at":"2025-10-06T10:21:32.889211Z","updated_at":"2025-10-07T13:20:27.647174Z","unit_usage":{"usage_id":17842,"client_id":11613,"unit_id":5495,"client_type":"tenant","is_archived":false},"price":"13700.00","contract_scan":null,"co_tenant":"","co_tenant_id_scan":null,"history":"1. Contract from 03.09.2025 to 02.09.2026","type_contract":"Short term from 1 to 3 months","co_tenant_id":""}}}
{"bitrix_id":"6384","ts":"2025-10-07T16:20:29+03:00","response":{"success":true,"message":"Contract successfully updated in Alma","alma_id":6526,"method":"PATCH","operation":"updated","data":{"id":6526,"name":"Contract_Igor_Byta__08.10.2025","number":"","start_date":"2025-10-08T00:00:00","end_date":"2025-12-29T00:00:00","external_id":"6384","created_at":"2025-10-02T09:20:24.914287Z","updated_at":"2025-10-07T13:20:29.894051Z","unit_usage":{"usage_id":17754,"client_id":9198,"unit_id":1927,"client_type":"tenant","is_archived":false},"price":"15000.00","contract_scan":null,"co_tenant":"","co_tenant_id_scan":null,"history":"","type_contract":"Short term from 1 to 3 months","co_tenant_id":""}}}
{"bitrix_id":"6380","ts":"2025-10-07T16:20:31+03:00","response":{"success":true,"message":"Contract successfully updated in Alma","alma_id":6524,"method":"PATCH","operation":"updated","data":{"id":6524,"name":"Contract_Nikita_Palshkov_Un. 291.1 \/ Elite Downtown residence, apt. 507_02.10.2025","number":"","start_date":"2025-10-02T00:00:00","end_date":"2025-10-08T00:00:00","external_id":"6380","created_at":"2025-10-02T07:34:38.636876Z","updated_at":"2025-10-07T13:20:31.741977Z","unit_usage":{"usage_id":17752,"client_id":13160,"unit_id":1701,"client_type":"tenant","is_archived":false},"price":"3416.00","contract_scan":null,"co_tenant":"","co_tenant_id_scan":null,"history":"","type_contract":"Short contract up to 1 month","co_tenant_id":""}}}
{"bitrix_id":"6376","ts":"2025-10-07T16:20:33+03:00","response":{"success":true,"message":"Contract successfully updated in Alma","alma_id":6580,"method":"PATCH","operation":"updated","data":{"id":6580,"name":"Contract_Olga_Vasyukova_Un. 192.1 \/ Marina Wharf 2, apt.  1103_05.10.2025","number":"","start_date":"2025-10-05T00:00:00","end_date":"2025-10-13T00:00:00","external_id":"6376","created_at":"2025-10-06T06:17:10.574155Z","updated_at":"2025-10-07T13:20:33.400156Z","unit_usage":{"usage_id":17815,"client_id":13158,"unit_id":1808,"client_type":"tenant","is_archived":false},"price":"5152.00","contract_scan":null,"co_tenant":"","co_tenant_id_scan":null,"history":"","type_contract":"Short contract up to 1 month","co_tenant_id":""}}}
{"bitrix_id":"6372","ts":"2025-10-07T16:20:35+03:00","response":{"success":true,"message":"Contract successfully updated in Alma","alma_id":6544,"method":"PATCH","operation":"updated","data":{"id":6544,"name":"Contract_Altantsetseg_Ganbold_Un. 545.1 \/ BLVD Central 2, apt. 1704_03.10.2025","number":"","start_date":"2025-10-03T00:00:00","end_date":"2025-11-03T00:00:00","external_id":"6372","created_at":"2025-10-03T09:49:25.416884Z","updated_at":"2025-10-07T13:20:35.115548Z","unit_usage":{"usage_id":17773,"client_id":13156,"unit_id":14932,"client_type":"tenant","is_archived":false},"price":"11799.00","contract_scan":null,"co_tenant":"","co_tenant_id_scan":null,"history":"1. Contract from 03.10.2025 to 03.11.2025","type_contract":"Short term from 1 to 3 months","co_tenant_id":""}}}
{"bitrix_id":"6368","ts":"2025-10-07T16:20:36+03:00","response":[2025-10-07 13:20:36] [ERROR] Unexpected error in contract synchronization: Contract synchronization failed: API request failed (400): {&quot;non_field_errors&quot;:[&quot;There are intersections in the use of the unit. Nearest intersection usage id:17716 usage type=tenant.&quot;]}<br>
{"success":false,"message":"Unexpected error: Contract synchronization failed"}}
{"bitrix_id":"6364","ts":"2025-10-07T16:20:38+03:00","response":{"success":true,"message":"Contract successfully updated in Alma","alma_id":6583,"method":"PATCH","operation":"updated","data":{"id":6583,"name":"Contract_Feyi_Odesola_Un. 711.1 \/ Azizi Riviera 41, apt. 310_28.09.2025","number":"","start_date":"2024-09-29T00:00:00","end_date":"2026-09-28T00:00:00","external_id":"6364","created_at":"2025-10-06T06:28:52.253012Z","updated_at":"2025-10-07T13:20:38.325822Z","unit_usage":{"usage_id":17819,"client_id":11753,"unit_id":15385,"client_type":"tenant","is_archived":false},"price":"7600.00","contract_scan":null,"co_tenant":"","co_tenant_id_scan":null,"history":"1. Contract from 29.09.2024 to 28.09.2026","type_contract":"Long-term 3+ months","co_tenant_id":""}}}
{"bitrix_id":"6362","ts":"2025-10-07T16:20:39+03:00","response":[2025-10-07 13:20:39] [ERROR] Failed to create contract: API request failed (400): {&quot;non_field_errors&quot;:[&quot;There are intersections in the use of the unit. Nearest intersection usage id:17756 usage type=tenant.&quot;]}<br>
[2025-10-07 13:20:39] [ERROR] Unexpected error in contract synchronization: Contract synchronization failed: API request failed (400): {&quot;non_field_errors&quot;:[&quot;There are intersections in the use of the unit. Nearest intersection usage id:17756 usage type=tenant.&quot;]}<br>
{"success":false,"message":"Unexpected error: Contract synchronization failed"}}
{"bitrix_id":"6360","ts":"2025-10-07T16:20:41+03:00","response":{"success":true,"message":"Contract successfully updated in Alma","alma_id":6528,"method":"PATCH","operation":"updated","data":{"id":6528,"name":"Contract_Patrik_Jung_Un. 259.1 \/ Park Ridge Tower C, apt. 221_03.10.2025","number":"","start_date":"2025-10-03T00:00:00","end_date":"2025-11-03T00:00:00","external_id":"6360","created_at":"2025-10-02T10:47:06.352160Z","updated_at":"2025-10-07T13:20:41.657105Z","unit_usage":{"usage_id":17756,"client_id":13149,"unit_id":1751,"client_type":"tenant","is_archived":false},"price":"14799.00","contract_scan":null,"co_tenant":"","co_tenant_id_scan":null,"history":"","type_contract":"Short term from 1 to 3 months","co_tenant_id":""}}}
{"bitrix_id":"6358","ts":"2025-10-07T16:20:43+03:00","response":[2025-10-07 13:20:43] [ERROR] Unexpected error in contract synchronization: Contract synchronization failed: API request failed (400): {&quot;non_field_errors&quot;:[&quot;There are intersections in the use of the unit. Nearest intersection usage id:16934 usage type=tenant.&quot;]}<br>
{"success":false,"message":"Unexpected error: Contract synchronization failed"}}
{"bitrix_id":"6356","ts":"2025-10-07T16:20:44+03:00","response":{"success":true,"message":"Contract successfully updated in Alma","alma_id":6512,"method":"PATCH","operation":"updated","data":{"id":6512,"name":"Contract_Olga_Blinova_Un. 730.1 \/ 15 Northside - Tower 1, apt. A-1102_24.10.2025","number":"","start_date":"2025-10-24T00:00:00","end_date":"2026-10-24T00:00:00","external_id":"6356","created_at":"2025-10-01T09:30:49.247961Z","updated_at":"2025-10-07T13:20:44.835718Z","unit_usage":{"usage_id":17739,"client_id":13148,"unit_id":15430,"client_type":"tenant","is_archived":false},"price":"15500.00","contract_scan":null,"co_tenant":"","co_tenant_id_scan":null,"history":"","type_contract":"Long-term 3+ months","co_tenant_id":""}}}
{"bitrix_id":"6352","ts":"2025-10-07T16:20:46+03:00","response":{"success":true,"message":"Contract successfully updated in Alma","alma_id":6510,"method":"PATCH","operation":"updated","data":{"id":6510,"name":"Contract_Vadim_Rublev_Un. 128.1 \/ Dubai Gate 1, apt. 1006_30.09.2025","number":"","start_date":"2025-08-30T00:00:00","end_date":"2025-10-30T00:00:00","external_id":"6352","created_at":"2025-10-01T08:54:55.952268Z","updated_at":"2025-10-07T13:20:46.531555Z","unit_usage":{"usage_id":17737,"client_id":12670,"unit_id":1874,"client_type":"tenant","is_archived":false},"price":"8820.00","contract_scan":null,"co_tenant":"","co_tenant_id_scan":null,"history":"","type_contract":"Short term from 1 to 3 months","co_tenant_id":""}}}
{"bitrix_id":"6350","ts":"2025-10-07T16:20:48+03:00","response":{"success":true,"message":"Contract successfully updated in Alma","alma_id":6509,"method":"PATCH","operation":"updated","data":{"id":6509,"name":"Contract_Evgenia_Panitsidou_Un. 515.1 \/ Beach Vista Tower 1, apt. 701_30.09.2025","number":"","start_date":"2025-06-30T00:00:00","end_date":"2026-06-30T00:00:00","external_id":"6350","created_at":"2025-10-01T08:39:42.368688Z","updated_at":"2025-10-07T13:20:48.307071Z","unit_usage":{"usage_id":17736,"client_id":12006,"unit_id":5539,"client_type":"tenant","is_archived":false},"price":"16399.00","contract_scan":null,"co_tenant":"","co_tenant_id_scan":null,"history":"1. Contract from 30.06.2025 to 30.06.2026","type_contract":"Long-term 3+ months","co_tenant_id":""}}}
{"bitrix_id":"6346","ts":"2025-10-07T16:20:49+03:00","response":{"success":true,"message":"Contract successfully updated in Alma","alma_id":6506,"method":"PATCH","operation":"updated","data":{"id":6506,"name":"Contract_Boris_Boskholov_Un. 30.3 \/ Rimal 6, apt. 2\/201_28.09.2025","number":"","start_date":"2025-02-28T00:00:00","end_date":"2026-09-28T00:00:00","external_id":"6346","created_at":"2025-10-01T08:32:44.683409Z","updated_at":"2025-10-07T13:20:49.920176Z","unit_usage":{"usage_id":17733,"client_id":2926,"unit_id":2340,"client_type":"tenant","is_archived":false},"price":"5299.00","contract_scan":null,"co_tenant":"","co_tenant_id_scan":null,"history":"1. Contract from 28.02.2025 to 28.09.2026","type_contract":"Long-term 3+ months","co_tenant_id":""}}}
{"bitrix_id":"6342","ts":"2025-10-07T16:20:51+03:00","response":[2025-10-07 13:20:51] [ERROR] Failed to create contract: API request failed (400): {&quot;non_field_errors&quot;:[&quot;There are intersections in the use of the unit. Nearest intersection usage id:17616 usage type=tenant.&quot;]}<br>
[2025-10-07 13:20:51] [ERROR] Unexpected error in contract synchronization: Contract synchronization failed: API request failed (400): {&quot;non_field_errors&quot;:[&quot;There are intersections in the use of the unit. Nearest intersection usage id:17616 usage type=tenant.&quot;]}<br>
{"success":false,"message":"Unexpected error: Contract synchronization failed"}}
{"bitrix_id":"6340","ts":"2025-10-07T16:20:53+03:00","response":[2025-10-07 13:20:53] [ERROR] Unexpected error in contract synchronization: Contract synchronization failed: API request failed (400): {&quot;non_field_errors&quot;:[&quot;There are intersections in the use of the unit. Nearest intersection usage id:17849 usage type=tenant.&quot;]}<br>
{"success":false,"message":"Unexpected error: Contract synchronization failed"}}
{"bitrix_id":"6338","ts":"2025-10-07T16:20:54+03:00","response":{"success":true,"message":"Contract successfully updated in Alma","alma_id":6588,"method":"PATCH","operation":"updated","data":{"id":6588,"name":"Contract_Ayaulym_Assylbek_Un. 91.1 \/ Bay Central 1, apt. 2508_30.09.2025","number":"","start_date":"2025-09-30T00:00:00","end_date":"2026-09-30T00:00:00","external_id":"6338","created_at":"2025-10-06T07:29:07.777320Z","updated_at":"2025-10-07T13:20:54.699434Z","unit_usage":{"usage_id":17824,"client_id":13142,"unit_id":1914,"client_type":"tenant","is_archived":false},"price":"12512.00","contract_scan":null,"co_tenant":"","co_tenant_id_scan":null,"history":"1. Contract from 30.09.2025 to 30.09.2026","type_contract":"Long-term 3+ months","co_tenant_id":""}}}
{"bitrix_id":"6336","ts":"2025-10-07T16:20:56+03:00","response":{"success":true,"message":"Contract successfully updated in Alma","alma_id":6533,"method":"PATCH","operation":"updated","data":{"id":6533,"name":"Contract_Daria_Esaulenko_Un. 22.1 \/ Reef Residence, apt. 33\/3305_06.10.2025","number":"","start_date":"2025-10-06T00:00:00","end_date":"2026-05-06T00:00:00","external_id":"6336","created_at":"2025-10-02T13:11:51.193537Z","updated_at":"2025-10-07T13:20:56.680072Z","unit_usage":{"usage_id":17761,"client_id":1770,"unit_id":1985,"client_type":"tenant","is_archived":false},"price":"10925.00","contract_scan":null,"co_tenant":"","co_tenant_id_scan":null,"history":"","type_contract":"Long-term 3+ months","co_tenant_id":""}}}
{"bitrix_id":"6334","ts":"2025-10-07T16:20:58+03:00","response":[2025-10-07 13:20:58] [ERROR] Unexpected error in contract synchronization: Contract synchronization failed: API request failed (400): {&quot;non_field_errors&quot;:[&quot;There are intersections in the use of the unit. Nearest intersection usage id:17761 usage type=tenant.&quot;]}<br>
{"success":false,"message":"Unexpected error: Contract synchronization failed"}}
{"bitrix_id":"6330","ts":"2025-10-07T16:21:00+03:00","response":{"success":true,"message":"Contract successfully updated in Alma","alma_id":6495,"method":"PATCH","operation":"updated","data":{"id":6495,"name":"Contract_Beyzanur_Zeybekler_Un. 9.3-2 \/ Up Tower, apt. 301_26.09.2025","number":"","start_date":"2025-08-26T00:00:00","end_date":"2025-10-17T00:00:00","external_id":"6330","created_at":"2025-09-30T12:00:37.440317Z","updated_at":"2025-10-07T13:20:59.992778Z","unit_usage":{"usage_id":17720,"client_id":12599,"unit_id":2390,"client_type":"tenant","is_archived":false},"price":"2379.00","contract_scan":null,"co_tenant":"","co_tenant_id_scan":null,"history":"","type_contract":"Short term from 1 to 3 months","co_tenant_id":""}}}
{"bitrix_id":"6328","ts":"2025-10-07T16:21:01+03:00","response":[2025-10-07 13:21:01] [ERROR] Failed to create contract: API request failed (400): {&quot;non_field_errors&quot;:[&quot;There are intersections in the use of the unit. Nearest intersection usage id:17707 usage type=tenant.&quot;]}<br>
[2025-10-07 13:21:01] [ERROR] Unexpected error in contract synchronization: Contract synchronization failed: API request failed (400): {&quot;non_field_errors&quot;:[&quot;There are intersections in the use of the unit. Nearest intersection usage id:17707 usage type=tenant.&quot;]}<br>
{"success":false,"message":"Unexpected error: Contract synchronization failed"}}
{"bitrix_id":"6326","ts":"2025-10-07T16:21:03+03:00","response":{"success":true,"message":"Contract successfully updated in Alma","alma_id":6490,"method":"PATCH","operation":"updated","data":{"id":6490,"name":"Contract_Anton_Nastenko_Un. 721.1 \/ BOTANICA TOWER, apt. 1605_30.09.2025","number":"","start_date":"2025-08-31T00:00:00","end_date":"2025-10-30T00:00:00","external_id":"6326","created_at":"2025-09-30T09:45:56.026067Z","updated_at":"2025-10-07T13:21:03.212546Z","unit_usage":{"usage_id":17715,"client_id":12241,"unit_id":15422,"client_type":"tenant","is_archived":false},"price":"6099.00","contract_scan":null,"co_tenant":"","co_tenant_id_scan":null,"history":"","type_contract":"Short term from 1 to 3 months","co_tenant_id":""}}}
{"bitrix_id":"6320","ts":"2025-10-07T16:21:05+03:00","response":{"success":true,"message":"Contract successfully updated in Alma","alma_id":6488,"method":"PATCH","operation":"updated","data":{"id":6488,"name":"Contract_Alena_Fedoseeva_Un. 295.1 \/ Park Ridge Tower C, apt. 403_28.10.2025","number":"","start_date":"2025-10-28T00:00:00","end_date":"2026-01-12T00:00:00","external_id":"6320","created_at":"2025-09-30T08:46:25.210427Z","updated_at":"2025-10-07T13:21:05.081802Z","unit_usage":{"usage_id":17713,"client_id":13135,"unit_id":1712,"client_type":"tenant","is_archived":false},"price":"14700.00","contract_scan":null,"co_tenant":"","co_tenant_id_scan":null,"history":"","type_contract":"Short term from 1 to 3 months","co_tenant_id":""}}}
{"bitrix_id":"6316","ts":"2025-10-07T16:21:06+03:00","response":[2025-10-07 13:21:06] [ERROR] Failed to create contract: API request failed (400): {&quot;non_field_errors&quot;:[&quot;There are intersections in the use of the unit. Nearest intersection usage id:17849 usage type=tenant.&quot;]}<br>
[2025-10-07 13:21:06] [ERROR] Unexpected error in contract synchronization: Contract synchronization failed: API request failed (400): {&quot;non_field_errors&quot;:[&quot;There are intersections in the use of the unit. Nearest intersection usage id:17849 usage type=tenant.&quot;]}<br>
{"success":false,"message":"Unexpected error: Contract synchronization failed"}}
{"bitrix_id":"6312","ts":"2025-10-07T16:21:08+03:00","response":{"success":true,"message":"Contract successfully updated in Alma","alma_id":6486,"method":"PATCH","operation":"updated","data":{"id":6486,"name":"Contract_Mamysheva_Vladislava_Un. 207.1 \/ Park Ridge Tower C, apt. 312_14.10.2025","number":"","start_date":"2025-10-14T00:00:00","end_date":"2026-01-14T00:00:00","external_id":"6312","created_at":"2025-09-30T08:27:09.034624Z","updated_at":"2025-10-07T13:21:08.110944Z","unit_usage":{"usage_id":17711,"client_id":13133,"unit_id":1790,"client_type":"tenant","is_archived":false},"price":"15199.00","contract_scan":null,"co_tenant":"","co_tenant_id_scan":null,"history":"","type_contract":"Short term from 1 to 3 months","co_tenant_id":""}}}
{"bitrix_id":"6310","ts":"2025-10-07T16:21:09+03:00","response":{"success":true,"message":"Contract successfully updated in Alma","alma_id":6556,"method":"PATCH","operation":"updated","data":{"id":6556,"name":"Contract_Omar Ayman Hassan_Ghanem _Un. 201.1 \/ Lake city tower, apt. 1303_27.09.2025","number":"","start_date":"2025-08-27T00:00:00","end_date":"2025-10-27T00:00:00","external_id":"6310","created_at":"2025-10-03T12:40:51.971231Z","updated_at":"2025-10-07T13:21:09.786340Z","unit_usage":{"usage_id":17788,"client_id":12738,"unit_id":1797,"client_type":"tenant","is_archived":false},"price":"5999.00","contract_scan":null,"co_tenant":"","co_tenant_id_scan":null,"history":"","type_contract":"Short term from 1 to 3 months","co_tenant_id":""}}}
{"bitrix_id":"6308","ts":"2025-10-07T16:21:11+03:00","response":[2025-10-07 13:21:11] [ERROR] Failed to create contract: API request failed (400): {&quot;non_field_errors&quot;:[&quot;Rental period end date must be greater than today.&quot;]}<br>
[2025-10-07 13:21:11] [ERROR] Unexpected error in contract synchronization: Contract synchronization failed: API request failed (400): {&quot;non_field_errors&quot;:[&quot;Rental period end date must be greater than today.&quot;]}<br>
{"success":false,"message":"Unexpected error: Contract synchronization failed"}}
{"bitrix_id":"6306","ts":"2025-10-07T16:21:13+03:00","response":{"success":true,"message":"Contract successfully updated in Alma","alma_id":6511,"method":"PATCH","operation":"updated","data":{"id":6511,"name":"Contract_Alise_Kolesnicenko*_Un. 65.1 \/ Yacht Bay, apt. 1504_28.09.2025","number":"","start_date":"2025-06-28T00:00:00","end_date":"2025-10-28T00:00:00","external_id":"6306","created_at":"2025-10-01T09:30:39.944966Z","updated_at":"2025-10-07T13:21:13.024759Z","unit_usage":{"usage_id":17738,"client_id":12083,"unit_id":1933,"client_type":"tenant","is_archived":false},"price":"5799.00","contract_scan":null,"co_tenant":"","co_tenant_id_scan":null,"history":"","type_contract":"Short contract up to 1 month","co_tenant_id":""}}}
{"bitrix_id":"6302","ts":"2025-10-07T16:21:14+03:00","response":{"success":true,"message":"Contract successfully updated in Alma","alma_id":6473,"method":"PATCH","operation":"updated","data":{"id":6473,"name":"Contract_Meraj_Mirzaei_Un. 639.1 \/ Burj Royal, apt. 5004_29.09.2025","number":"","start_date":"2025-09-29T00:00:00","end_date":"2025-10-30T00:00:00","external_id":"6302","created_at":"2025-09-29T13:06:03.972008Z","updated_at":"2025-10-07T13:21:14.690968Z","unit_usage":{"usage_id":17692,"client_id":12404,"unit_id":15407,"client_type":"tenant","is_archived":false},"price":"13499.00","contract_scan":null,"co_tenant":"","co_tenant_id_scan":null,"history":"1. Contract from 29.09.2025 to 30.10.2025","type_contract":"Short term from 1 to 3 months","co_tenant_id":""}}}
{"bitrix_id":"6296","ts":"2025-10-07T16:21:16+03:00","response":{"success":true,"message":"Contract successfully updated in Alma","alma_id":6466,"method":"PATCH","operation":"updated","data":{"id":6466,"name":"Contract_Emiliia_Melikova_Un. 27.1 \/ Discovery Gardens 38, apt. 401_09.10.2025","number":"","start_date":"2025-10-09T00:00:00","end_date":"2025-12-09T00:00:00","external_id":"6296","created_at":"2025-09-29T10:05:35.042787Z","updated_at":"2025-10-07T13:21:16.342971Z","unit_usage":{"usage_id":17684,"client_id":13119,"unit_id":1975,"client_type":"tenant","is_archived":false},"price":"7700.00","contract_scan":null,"co_tenant":"","co_tenant_id_scan":null,"history":"","type_contract":"Short term from 1 to 3 months","co_tenant_id":""}}}
{"bitrix_id":"6294","ts":"2025-10-07T16:21:17+03:00","response":{"success":true,"message":"Contract successfully created in Alma","alma_id":6629,"method":"POST","operation":"created","data":{"id":6629,"name":"Contract_Yelizaveta_Taleika_Un. 208.1 \/ Park Ridge Tower C, apt. 306_30.09.2025","number":"","start_date":"2025-07-30T00:00:00","end_date":"2026-03-30T00:00:00","external_id":"6294","created_at":"2025-10-07T13:21:17.784095Z","updated_at":"2025-10-07T13:21:17.794134Z","unit_usage":{"usage_id":17878,"client_id":1798,"unit_id":1787,"client_type":"tenant","is_archived":false},"price":"9599.00","contract_scan":null,"co_tenant":"","co_tenant_id_scan":null,"history":"1. Contract from 30.07.2025 to 30.03.2026","type_contract":"Long-term 3+ months","co_tenant_id":""}}}
{"bitrix_id":"6292","ts":"2025-10-07T16:21:19+03:00","response":[2025-10-07 13:21:19] [ERROR] Failed to create contract: API request failed (400): {&quot;non_field_errors&quot;:[&quot;There are intersections in the use of the unit. Nearest intersection usage id:17682 usage type=tenant.&quot;]}<br>
[2025-10-07 13:21:19] [ERROR] Unexpected error in contract synchronization: Contract synchronization failed: API request failed (400): {&quot;non_field_errors&quot;:[&quot;There are intersections in the use of the unit. Nearest intersection usage id:17682 usage type=tenant.&quot;]}<br>
{"success":false,"message":"Unexpected error: Contract synchronization failed"}}
{"bitrix_id":"6288","ts":"2025-10-07T16:21:20+03:00","response":{"success":true,"message":"Contract successfully updated in Alma","alma_id":6507,"method":"PATCH","operation":"updated","data":{"id":6507,"name":"Contract_Alena_Agafonova_Un. 2.2 \/ Marina Wharf 2, apt. 1701_30.09.2025","number":"","start_date":"2025-09-30T00:00:00","end_date":"2025-10-31T00:00:00","external_id":"6288","created_at":"2025-10-01T08:38:16.896717Z","updated_at":"2025-10-07T13:21:20.877842Z","unit_usage":{"usage_id":17734,"client_id":13115,"unit_id":2047,"client_type":"tenant","is_archived":false},"price":"6199.00","contract_scan":null,"co_tenant":"","co_tenant_id_scan":null,"history":"","type_contract":"Short term from 1 to 3 months","co_tenant_id":""}}}
{"bitrix_id":"6286","ts":"2025-10-07T16:21:22+03:00","response":{"success":true,"message":"Contract successfully updated in Alma","alma_id":6452,"method":"PATCH","operation":"updated","data":{"id":6452,"name":"Contract_No name_Vitadello__29.09.2025","number":"","start_date":"2025-09-29T00:00:00","end_date":"2025-11-14T00:00:00","external_id":"6286","created_at":"2025-09-28T20:58:27.565731Z","updated_at":"2025-10-07T13:21:22.461726Z","unit_usage":{"usage_id":17668,"client_id":13111,"unit_id":15440,"client_type":"tenant","is_archived":false},"price":"10499.00","contract_scan":null,"co_tenant":"","co_tenant_id_scan":null,"history":"","type_contract":"Short term from 1 to 3 months","co_tenant_id":""}}}
{"bitrix_id":"6284","ts":"2025-10-07T16:21:24+03:00","response":[2025-10-07 13:21:24] [ERROR] Failed to create contract: API request failed (400): {&quot;non_field_errors&quot;:[&quot;There are intersections in the use of the unit. Nearest intersection usage id:17667 usage type=tenant.&quot;]}<br>
[2025-10-07 13:21:24] [ERROR] Unexpected error in contract synchronization: Contract synchronization failed: API request failed (400): {&quot;non_field_errors&quot;:[&quot;There are intersections in the use of the unit. Nearest intersection usage id:17667 usage type=tenant.&quot;]}<br>
{"success":false,"message":"Unexpected error: Contract synchronization failed"}}
{"bitrix_id":"6280","ts":"2025-10-07T16:21:25+03:00","response":{"success":true,"message":"Contract successfully updated in Alma","alma_id":6530,"method":"PATCH","operation":"updated","data":{"id":6530,"name":"Contract_Kenza_Osmane_Un. 554.1 \/ Orchid Creek Beach, apt. 401_02.10.2025","number":"","start_date":"2025-10-04T00:00:00","end_date":"2026-10-02T00:00:00","external_id":"6280","created_at":"2025-10-02T12:26:33.471373Z","updated_at":"2025-10-07T13:21:25.849227Z","unit_usage":{"usage_id":17758,"client_id":13110,"unit_id":15023,"client_type":"tenant","is_archived":false},"price":"11899.00","contract_scan":null,"co_tenant":"","co_tenant_id_scan":null,"history":"1. Contract from 04.10.2025 to 02.10.2026","type_contract":"Long-term 3+ months","co_tenant_id":""}}}
{"bitrix_id":"6270","ts":"2025-10-07T16:21:27+03:00","response":{"success":true,"message":"Contract successfully updated in Alma","alma_id":6448,"method":"PATCH","operation":"updated","data":{"id":6448,"name":"Contract_Mitchel_Nabil Ghosn_Un. 402.1 \/ Park Ridge Tower C, apt. 1716_12.10.2025","number":"","start_date":"2025-10-12T00:00:00","end_date":"2025-11-30T00:00:00","external_id":"6270","created_at":"2025-09-27T17:11:39.356516Z","updated_at":"2025-10-07T13:21:27.538491Z","unit_usage":{"usage_id":17663,"client_id":13106,"unit_id":1639,"client_type":"tenant","is_archived":false},"price":"24000.00","contract_scan":null,"co_tenant":"","co_tenant_id_scan":null,"history":"","type_contract":"Short term from 1 to 3 months","co_tenant_id":""}}}
{"bitrix_id":"6266","ts":"2025-10-07T16:21:29+03:00","response":{"success":true,"message":"Contract successfully updated in Alma","alma_id":6447,"method":"PATCH","operation":"updated","data":{"id":6447,"name":"Contract_Vladev Angel 254.1_27.09.2025","number":"","start_date":"2025-10-05T00:00:00","end_date":"2026-10-05T00:00:00","external_id":"6266","created_at":"2025-09-27T15:25:31.588450Z","updated_at":"2025-10-07T13:21:29.161051Z","unit_usage":{"usage_id":17662,"client_id":13105,"unit_id":1755,"client_type":"tenant","is_archived":false},"price":"11499.00","contract_scan":null,"co_tenant":"","co_tenant_id_scan":null,"history":"","type_contract":"Long-term 3+ months","co_tenant_id":""}}}
{"bitrix_id":"6256","ts":"2025-10-07T16:21:30+03:00","response":{"success":true,"message":"Contract successfully updated in Alma","alma_id":6445,"method":"PATCH","operation":"updated","data":{"id":6445,"name":"Contract_Denis_Sapelkin__Un. 160.1 \/ Goldcrest Executive, apt. 3304_09.10.2025","number":"","start_date":"2025-10-09T00:00:00","end_date":"2025-11-09T00:00:00","external_id":"6256","created_at":"2025-09-27T11:22:10.890434Z","updated_at":"2025-10-07T13:21:30.941839Z","unit_usage":{"usage_id":17660,"client_id":13104,"unit_id":1836,"client_type":"tenant","is_archived":false},"price":"8549.00","contract_scan":null,"co_tenant":"","co_tenant_id_scan":null,"history":"","type_contract":"Short contract up to 1 month","co_tenant_id":""}}}
{"bitrix_id":"6254","ts":"2025-10-07T16:21:32+03:00","response":{"success":true,"message":"Contract successfully updated in Alma","alma_id":6443,"method":"PATCH","operation":"updated","data":{"id":6443,"name":"Contract_Sergey_Romanov_Un. 178.1 \/ Indigo tower, apt. 1215_08.10.2025","number":"","start_date":"2025-10-08T00:00:00","end_date":"2025-12-31T00:00:00","external_id":"6254","created_at":"2025-09-27T10:51:13.831690Z","updated_at":"2025-10-07T13:21:32.504001Z","unit_usage":{"usage_id":17658,"client_id":13102,"unit_id":1824,"client_type":"tenant","is_archived":false},"price":"13100.00","contract_scan":null,"co_tenant":"","co_tenant_id_scan":null,"history":"","type_contract":"Short term from 1 to 3 months","co_tenant_id":""}}}
{"bitrix_id":"6252","ts":"2025-10-07T16:21:34+03:00","response":[2025-10-07 13:21:34] [ERROR] Failed to create contract: API request failed (400): {&quot;non_field_errors&quot;:[&quot;There are intersections in the use of the unit. Nearest intersection usage id:17658 usage type=tenant.&quot;]}<br>
[2025-10-07 13:21:34] [ERROR] Unexpected error in contract synchronization: Contract synchronization failed: API request failed (400): {&quot;non_field_errors&quot;:[&quot;There are intersections in the use of the unit. Nearest intersection usage id:17658 usage type=tenant.&quot;]}<br>
{"success":false,"message":"Unexpected error: Contract synchronization failed"}}
{"bitrix_id":"6250","ts":"2025-10-07T16:21:35+03:00","response":{"success":true,"message":"Contract successfully created in Alma","alma_id":6630,"method":"POST","operation":"created","data":{"id":6630,"name":"Contract_Altynai Zarylbek_Kyzy_Un. 145.1 \/ Elite Residence, apt. 1410_14.09.2025","number":"","start_date":"2025-06-14T00:00:00","end_date":"2025-10-14T00:00:00","external_id":"6250","created_at":"2025-10-07T13:21:35.559711Z","updated_at":"2025-10-07T13:21:35.569355Z","unit_usage":{"usage_id":17879,"client_id":11995,"unit_id":1864,"client_type":"tenant","is_archived":false},"price":"7000.00","contract_scan":null,"co_tenant":"","co_tenant_id_scan":null,"history":"","type_contract":"Short term from 1 to 3 months","co_tenant_id":""}}}
{"bitrix_id":"6248","ts":"2025-10-07T16:21:37+03:00","response":{"success":true,"message":"Contract successfully updated in Alma","alma_id":6440,"method":"PATCH","operation":"updated","data":{"id":6440,"name":"Contract_Khalilova_Eliza_Un. 584.1 \/ ZUMURUD, apt. 1304_27.09.2025","number":"","start_date":"2025-09-27T00:00:00","end_date":"2025-11-09T00:00:00","external_id":"6248","created_at":"2025-09-26T17:38:32.992170Z","updated_at":"2025-10-07T13:21:37.173110Z","unit_usage":{"usage_id":17655,"client_id":13100,"unit_id":15272,"client_type":"tenant","is_archived":false},"price":"10639.00","contract_scan":null,"co_tenant":"","co_tenant_id_scan":null,"history":"","type_contract":"Short term from 1 to 3 months","co_tenant_id":""}}}
{"bitrix_id":"6246","ts":"2025-10-07T16:21:38+03:00","response":{"success":true,"message":"Contract successfully updated in Alma","alma_id":6441,"method":"PATCH","operation":"updated","data":{"id":6441,"name":"Contract_Viktoriya_Bondarenko__Un. 601.1 \/ Princess Tower, apt.  3509_28.09.2025","number":"","start_date":"2025-09-28T00:00:00","end_date":"2026-09-28T00:00:00","external_id":"6246","created_at":"2025-09-27T04:22:35.577415Z","updated_at":"2025-10-07T13:21:38.731022Z","unit_usage":{"usage_id":17656,"client_id":13099,"unit_id":15088,"client_type":"tenant","is_archived":false},"price":"13500.00","contract_scan":null,"co_tenant":"","co_tenant_id_scan":null,"history":"","type_contract":"Long-term 3+ months","co_tenant_id":""}}}
{"bitrix_id":"6244","ts":"2025-10-07T16:21:40+03:00","response":{"success":true,"message":"Contract successfully updated in Alma","alma_id":6439,"method":"PATCH","operation":"updated","data":{"id":6439,"name":"Contract_No name_Contact_Un. 355.2 \/ Shams 4, apt. 402_12.10.2025","number":"","start_date":"2025-10-12T00:00:00","end_date":"2025-10-29T00:00:00","external_id":"6244","created_at":"2025-09-26T15:41:22.852890Z","updated_at":"2025-10-07T13:21:40.419319Z","unit_usage":{"usage_id":17654,"client_id":13098,"unit_id":2038,"client_type":"tenant","is_archived":false},"price":"5040.00","contract_scan":null,"co_tenant":"","co_tenant_id_scan":null,"history":"","type_contract":"Short contract up to 1 month","co_tenant_id":""}}}
{"bitrix_id":"6242","ts":"2025-10-07T16:21:42+03:00","response":{"success":true,"message":"Contract successfully updated in Alma","alma_id":6474,"method":"PATCH","operation":"updated","data":{"id":6474,"name":"Contract_Milena_Ferrari_Un. 368.1 \/ MJL Asayel 2, apt. 305_27.09.2025","number":"","start_date":"2025-09-27T00:00:00","end_date":"2025-10-27T00:00:00","external_id":"6242","created_at":"2025-09-29T13:38:34.075993Z","updated_at":"2025-10-07T13:21:42.001712Z","unit_usage":{"usage_id":17695,"client_id":13097,"unit_id":2593,"client_type":"tenant","is_archived":false},"price":"15500.00","contract_scan":null,"co_tenant":"","co_tenant_id_scan":null,"history":"","type_contract":"Short term from 1 to 3 months","co_tenant_id":""}}}
{"bitrix_id":"6240","ts":"2025-10-07T16:21:43+03:00","response":{"success":true,"message":"Contract successfully updated in Alma","alma_id":6477,"method":"PATCH","operation":"updated","data":{"id":6477,"name":"Contract_Rabbia_Amin*_Un. 277.1 \/ Concorde tower, apt. 401_29.09.2025","number":"","start_date":"2025-07-29T00:00:00","end_date":"2025-10-29T00:00:00","external_id":"6240","created_at":"2025-09-29T18:13:10.675718Z","updated_at":"2025-10-07T13:21:43.627625Z","unit_usage":{"usage_id":17699,"client_id":12291,"unit_id":1737,"client_type":"tenant","is_archived":false},"price":"11799.00","contract_scan":null,"co_tenant":"","co_tenant_id_scan":null,"history":"","type_contract":"Short term from 1 to 3 months","co_tenant_id":""}}}
{"bitrix_id":"6238","ts":"2025-10-07T16:21:45+03:00","response":{"success":true,"message":"Contract successfully updated in Alma","alma_id":6425,"method":"PATCH","operation":"updated","data":{"id":6425,"name":"Contract_Viktoria_Shabad_Un. 418.1 \/ Azizi Riviera 42, apt. 203_14.10.2025","number":"","start_date":"2025-10-14T00:00:00","end_date":"2026-05-14T00:00:00","external_id":"6238","created_at":"2025-09-25T20:28:33.816085Z","updated_at":"2025-10-07T13:21:45.273112Z","unit_usage":{"usage_id":17637,"client_id":13086,"unit_id":1635,"client_type":"tenant","is_archived":false},"price":"11499.00","contract_scan":null,"co_tenant":"","co_tenant_id_scan":null,"history":"","type_contract":"Long-term 3+ months","co_tenant_id":""}}}
{"bitrix_id":"6232","ts":"2025-10-07T16:21:47+03:00","response":{"success":true,"message":"Contract successfully updated in Alma","alma_id":6432,"method":"PATCH","operation":"updated","data":{"id":6432,"name":"Contract_Lost lead for the call from 971543265089 by Callge__Un. 8.4 \/ Sadaf 6, apt. 212_15.10.2025","number":"","start_date":"2025-10-15T00:00:00","end_date":"2025-11-22T00:00:00","external_id":"6232","created_at":"2025-09-26T11:04:22.744227Z","updated_at":"2025-10-07T13:21:47.025524Z","unit_usage":{"usage_id":17647,"client_id":13085,"unit_id":5534,"client_type":"tenant","is_archived":false},"price":"6649.00","contract_scan":null,"co_tenant":"","co_tenant_id_scan":null,"history":"","type_contract":"Short term from 1 to 3 months","co_tenant_id":""}}}
{"bitrix_id":"6226","ts":"2025-10-07T16:21:48+03:00","response":[2025-10-07 13:21:48] [ERROR] Unexpected error in contract synchronization: Contract synchronization failed: API request failed (400): {&quot;non_field_errors&quot;:[&quot;There are intersections in the use of the unit. Nearest intersection usage id:15820 usage type=tenant.&quot;]}<br>
{"success":false,"message":"Unexpected error: Contract synchronization failed"}}
{"bitrix_id":"6222","ts":"2025-10-07T16:21:50+03:00","response":{"success":true,"message":"Contract successfully updated in Alma","alma_id":6421,"method":"PATCH","operation":"updated","data":{"id":6421,"name":"Contract_Kheruvimov_Danil_Un. 8.4 \/ Sadaf 6, apt. 212_24.09.2025","number":"","start_date":"2025-09-25T00:00:00","end_date":"2025-10-25T00:00:00","external_id":"6222","created_at":"2025-09-25T12:36:40.835639Z","updated_at":"2025-10-07T13:21:50.899786Z","unit_usage":{"usage_id":17633,"client_id":13074,"unit_id":2376,"client_type":"tenant","is_archived":false},"price":"4900.00","contract_scan":null,"co_tenant":"","co_tenant_id_scan":null,"history":"","type_contract":"Short term from 1 to 3 months","co_tenant_id":""}}}
{"bitrix_id":"6204","ts":"2025-10-07T16:21:52+03:00","response":[2025-10-07 13:21:52] [ERROR] Failed to create contract: API request failed (400): {&quot;non_field_errors&quot;:[&quot;There are intersections in the use of the unit. Nearest intersection usage id:17749 usage type=tenant.&quot;]}<br>
[2025-10-07 13:21:52] [ERROR] Unexpected error in contract synchronization: Contract synchronization failed: API request failed (400): {&quot;non_field_errors&quot;:[&quot;There are intersections in the use of the unit. Nearest intersection usage id:17749 usage type=tenant.&quot;]}<br>
{"success":false,"message":"Unexpected error: Contract synchronization failed"}}
{"bitrix_id":"6202","ts":"2025-10-07T16:21:54+03:00","response":[2025-10-07 13:21:54] [ERROR] Failed to create contract: API request failed (400): {&quot;non_field_errors&quot;:[&quot;There are intersections in the use of the unit. Nearest intersection usage id:17623 usage type=tenant.&quot;]}<br>
[2025-10-07 13:21:54] [ERROR] Unexpected error in contract synchronization: Contract synchronization failed: API request failed (400): {&quot;non_field_errors&quot;:[&quot;There are intersections in the use of the unit. Nearest intersection usage id:17623 usage type=tenant.&quot;]}<br>
{"success":false,"message":"Unexpected error: Contract synchronization failed"}}
{"bitrix_id":"6200","ts":"2025-10-07T16:21:55+03:00","response":{"success":true,"message":"Contract successfully updated in Alma","alma_id":6411,"method":"PATCH","operation":"updated","data":{"id":6411,"name":"Contract_Maxim_Kozhnov_Un. 76.1 \/ The Residence at Marina Gate 2, apt. 3310_25.09.2025","number":"","start_date":"2024-07-25T00:00:00","end_date":"2026-09-25T00:00:00","external_id":"6200","created_at":"2025-09-25T08:32:36.186346Z","updated_at":"2025-10-07T13:21:55.678999Z","unit_usage":{"usage_id":17622,"client_id":1767,"unit_id":1928,"client_type":"tenant","is_archived":false},"price":"15500.00","contract_scan":null,"co_tenant":"","co_tenant_id_scan":null,"history":"1. Contract from 25.07.2024 to 25.09.2026","type_contract":"Long-term 3+ months","co_tenant_id":""}}}
{"bitrix_id":"6194","ts":"2025-10-07T16:21:57+03:00","response":[2025-10-07 13:21:57] [ERROR] Unexpected error in contract synchronization: Contract synchronization failed: API request failed (400): {&quot;non_field_errors&quot;:[&quot;There are intersections in the use of the unit. Nearest intersection usage id:17206 usage type=tenant.&quot;]}<br>
{"success":false,"message":"Unexpected error: Contract synchronization failed"}}
{"bitrix_id":"6192","ts":"2025-10-07T16:21:58+03:00","response":[2025-10-07 13:21:58] [ERROR] Failed to create contract: API request failed (400): {&quot;non_field_errors&quot;:[&quot;There are intersections in the use of the unit. Nearest intersection usage id:17509 usage type=tenant.&quot;]}<br>
[2025-10-07 13:21:58] [ERROR] Unexpected error in contract synchronization: Contract synchronization failed: API request failed (400): {&quot;non_field_errors&quot;:[&quot;There are intersections in the use of the unit. Nearest intersection usage id:17509 usage type=tenant.&quot;]}<br>
{"success":false,"message":"Unexpected error: Contract synchronization failed"}}
{"bitrix_id":"6190","ts":"2025-10-07T16:22:00+03:00","response":{"success":true,"message":"Contract successfully updated in Alma","alma_id":6404,"method":"PATCH","operation":"updated","data":{"id":6404,"name":"Contract_Freddie J_Jones_Un. 324.1 \/ Azizi Mina, apt. 420_24.09.2025","number":"","start_date":"2025-05-24T00:00:00","end_date":"2025-10-24T00:00:00","external_id":"6190","created_at":"2025-09-24T14:14:18.819245Z","updated_at":"2025-10-07T13:22:00.407146Z","unit_usage":{"usage_id":17615,"client_id":11882,"unit_id":1695,"client_type":"tenant","is_archived":false},"price":"12500.00","contract_scan":null,"co_tenant":"","co_tenant_id_scan":null,"history":"","type_contract":"Long-term 3+ months","co_tenant_id":""}}}
{"bitrix_id":"6186","ts":"2025-10-07T16:22:02+03:00","response":{"success":true,"message":"Contract successfully updated in Alma","alma_id":6399,"method":"PATCH","operation":"updated","data":{"id":6399,"name":"Contract_Chetan_Parwate__23.09.2025","number":"","start_date":"2025-09-23T00:00:00","end_date":"2025-10-23T00:00:00","external_id":"6186","created_at":"2025-09-24T13:09:47.353703Z","updated_at":"2025-10-07T13:22:02.194197Z","unit_usage":{"usage_id":17610,"client_id":13060,"unit_id":1934,"client_type":"tenant","is_archived":false},"price":"9750.00","contract_scan":null,"co_tenant":"","co_tenant_id_scan":null,"history":"","type_contract":"Short term from 1 to 3 months","co_tenant_id":""}}}
{"bitrix_id":"6182","ts":"2025-10-07T16:22:04+03:00","response":{"success":true,"message":"Contract successfully updated in Alma","alma_id":6392,"method":"PATCH","operation":"updated","data":{"id":6392,"name":"Contract_Valentina_Sofia Quilarq_Un. 139.1 \/ Continental tower, apt. 2405_02.10.2025","number":"","start_date":"2025-10-02T00:00:00","end_date":"2026-10-02T00:00:00","external_id":"6182","created_at":"2025-09-24T07:09:39.755870Z","updated_at":"2025-10-07T13:22:04.008948Z","unit_usage":{"usage_id":17602,"client_id":13052,"unit_id":1862,"client_type":"tenant","is_archived":false},"price":"12000.00","contract_scan":null,"co_tenant":"","co_tenant_id_scan":null,"history":"1. Contract from 02.10.2025 to 02.10.2026","type_contract":"Long-term 3+ months","co_tenant_id":""}}}
{"bitrix_id":"6176","ts":"2025-10-07T16:22:05+03:00","response":{"success":true,"message":"Contract successfully updated in Alma","alma_id":6391,"method":"PATCH","operation":"updated","data":{"id":6391,"name":"Contract_Stefania Valeria_Da Prato_Un. 607.1 \/ Peninsula Five, apt. 1004_10.10.2025","number":"","start_date":"2025-10-10T00:00:00","end_date":"2026-01-10T00:00:00","external_id":"6176","created_at":"2025-09-24T07:05:41.945108Z","updated_at":"2025-10-07T13:22:05.733339Z","unit_usage":{"usage_id":17601,"client_id":13046,"unit_id":15165,"client_type":"tenant","is_archived":false},"price":"10299.00","contract_scan":null,"co_tenant":"","co_tenant_id_scan":null,"history":"","type_contract":"Short term from 1 to 3 months","co_tenant_id":""}}}
{"bitrix_id":"6172","ts":"2025-10-07T16:22:07+03:00","response":{"success":true,"message":"Contract successfully updated in Alma","alma_id":6395,"method":"PATCH","operation":"updated","data":{"id":6395,"name":"Contract_Melisa Ceylan__Un. 162.1 \/ Princess tower, apt. 1202_01.10.2025","number":"","start_date":"2025-10-01T00:00:00","end_date":"2025-10-31T00:00:00","external_id":"6172","created_at":"2025-09-24T10:46:46.859039Z","updated_at":"2025-10-07T13:22:07.409121Z","unit_usage":{"usage_id":17606,"client_id":13056,"unit_id":1840,"client_type":"tenant","is_archived":false},"price":"11499.00","contract_scan":null,"co_tenant":"","co_tenant_id_scan":null,"history":"","type_contract":"Short term from 1 to 3 months","co_tenant_id":""}}}
{"bitrix_id":"6168","ts":"2025-10-07T16:22:09+03:00","response":{"success":true,"message":"Contract successfully updated in Alma","alma_id":6384,"method":"PATCH","operation":"updated","data":{"id":6384,"name":"Contract_Nueng_name_Un. 8.1 \/ Sadaf 6, apt. 212_26.09.2025","number":"","start_date":"2025-09-26T00:00:00","end_date":"2025-12-26T00:00:00","external_id":"6168","created_at":"2025-09-23T15:57:50.303655Z","updated_at":"2025-10-07T13:22:09.136922Z","unit_usage":{"usage_id":17590,"client_id":13076,"unit_id":2383,"client_type":"tenant","is_archived":false},"price":"6499.00","contract_scan":null,"co_tenant":"","co_tenant_id_scan":null,"history":"","type_contract":"Short term from 1 to 3 months","co_tenant_id":""}}}
{"bitrix_id":"6166","ts":"2025-10-07T16:22:10+03:00","response":[2025-10-07 13:22:10] [ERROR] Failed to create contract: API request failed (400): {&quot;non_field_errors&quot;:[&quot;There are intersections in the use of the unit. Nearest intersection usage id:17618 usage type=tenant.&quot;]}<br>
[2025-10-07 13:22:10] [ERROR] Unexpected error in contract synchronization: Contract synchronization failed: API request failed (400): {&quot;non_field_errors&quot;:[&quot;There are intersections in the use of the unit. Nearest intersection usage id:17618 usage type=tenant.&quot;]}<br>
{"success":false,"message":"Unexpected error: Contract synchronization failed"}}
{"bitrix_id":"6156","ts":"2025-10-07T16:22:12+03:00","response":{"success":true,"message":"Contract successfully updated in Alma","alma_id":6381,"method":"PATCH","operation":"updated","data":{"id":6381,"name":"Contract_No name_name_Un. 8.2 \/ Sadaf 6, apt. 212_13.10.2025","number":"","start_date":"2025-10-13T00:00:00","end_date":"2025-11-21T00:00:00","external_id":"6156","created_at":"2025-09-23T12:31:09.228782Z","updated_at":"2025-10-07T13:22:12.264761Z","unit_usage":{"usage_id":17587,"client_id":13043,"unit_id":2391,"client_type":"tenant","is_archived":false},"price":"6199.00","contract_scan":null,"co_tenant":"","co_tenant_id_scan":null,"history":"","type_contract":"Short term from 1 to 3 months","co_tenant_id":""}}}
{"bitrix_id":"6154","ts":"2025-10-07T16:22:13+03:00","response":{"success":true,"message":"Contract successfully updated in Alma","alma_id":6378,"method":"PATCH","operation":"updated","data":{"id":6378,"name":"Contract_Timur_Ayatov_Un. 309.1 \/ G R Travo B, apt. 207_30.09.2025","number":"","start_date":"2025-09-30T00:00:00","end_date":"2026-09-30T00:00:00","external_id":"6154","created_at":"2025-09-23T11:15:25.324377Z","updated_at":"2025-10-07T13:22:13.851374Z","unit_usage":{"usage_id":17584,"client_id":11945,"unit_id":1697,"client_type":"tenant","is_archived":false},"price":"9500.00","contract_scan":null,"co_tenant":"","co_tenant_id_scan":null,"history":"","type_contract":"Long-term 3+ months","co_tenant_id":""}}}
{"bitrix_id":"6152","ts":"2025-10-07T16:22:15+03:00","response":{"success":true,"message":"Contract successfully updated in Alma","alma_id":6539,"method":"PATCH","operation":"updated","data":{"id":6539,"name":"Contract_Petr_Pimenov_Un. 124.1 \/ Saba 3, apt. 1112_02.10.2025","number":"","start_date":"2025-08-02T00:00:00","end_date":"2025-11-02T00:00:00","external_id":"6152","created_at":"2025-10-02T21:40:08.747726Z","updated_at":"2025-10-07T13:22:15.420270Z","unit_usage":{"usage_id":17767,"client_id":12466,"unit_id":1877,"client_type":"tenant","is_archived":false},"price":"5899.00","contract_scan":null,"co_tenant":"","co_tenant_id_scan":null,"history":"1. Contract from 02.08.2025 to 02.11.2025","type_contract":"Short term from 1 to 3 months","co_tenant_id":""}}}
{"bitrix_id":"6150","ts":"2025-10-07T16:22:17+03:00","response":[2025-10-07 13:22:17] [ERROR] Failed to create contract: API request failed (400): {&quot;non_field_errors&quot;:[&quot;There are intersections in the use of the unit. Nearest intersection usage id:17589 usage type=tenant.&quot;]}<br>
[2025-10-07 13:22:17] [ERROR] Unexpected error in contract synchronization: Contract synchronization failed: API request failed (400): {&quot;non_field_errors&quot;:[&quot;There are intersections in the use of the unit. Nearest intersection usage id:17589 usage type=tenant.&quot;]}<br>
{"success":false,"message":"Unexpected error: Contract synchronization failed"}}
{"bitrix_id":"6132","ts":"2025-10-07T16:22:19+03:00","response":{"success":true,"message":"Contract successfully updated in Alma","alma_id":6313,"method":"PATCH","operation":"updated","data":{"id":6313,"name":"Contract_Megha_Bhadrakumar Karatela_Un. 137.1 \/ Jumeirah Bay X1-1, apt. 705_30.09.2025","number":"","start_date":"2025-09-30T00:00:00","end_date":"2025-12-30T00:00:00","external_id":"6132","created_at":"2025-09-22T11:53:08.809280Z","updated_at":"2025-10-07T13:22:19.161203Z","unit_usage":{"usage_id":17516,"client_id":12962,"unit_id":1861,"client_type":"tenant","is_archived":false},"price":"8929.00","contract_scan":null,"co_tenant":"","co_tenant_id_scan":null,"history":"","type_contract":"Short term from 1 to 3 months","co_tenant_id":""}}}
{"bitrix_id":"6130","ts":"2025-10-07T16:22:20+03:00","response":{"success":true,"message":"Contract successfully updated in Alma","alma_id":6312,"method":"PATCH","operation":"updated","data":{"id":6312,"name":"Contract_Valeriia_Frantseva_Un. 243.1 \/ Azizi Riviera 44, apt. 602_28.09.2025","number":"","start_date":"2025-09-28T00:00:00","end_date":"2025-10-28T00:00:00","external_id":"6130","created_at":"2025-09-22T11:47:47.318181Z","updated_at":"2025-10-07T13:22:20.794781Z","unit_usage":{"usage_id":17515,"client_id":13032,"unit_id":1732,"client_type":"tenant","is_archived":false},"price":"6500.00","contract_scan":null,"co_tenant":"","co_tenant_id_scan":null,"history":"","type_contract":"Short contract up to 1 month","co_tenant_id":""}}}
{"bitrix_id":"6128","ts":"2025-10-07T16:22:22+03:00","response":[2025-10-07 13:22:22] [ERROR] Unexpected error in contract synchronization: Contract synchronization failed: API request failed (400): {&quot;non_field_errors&quot;:[&quot;There are intersections in the use of the unit. Nearest intersection usage id:17598 usage type=tenant.&quot;]}<br>
{"success":false,"message":"Unexpected error: Contract synchronization failed"}}
{"bitrix_id":"6124","ts":"2025-10-07T16:22:24+03:00","response":{"success":true,"message":"Contract successfully updated in Alma","alma_id":6450,"method":"PATCH","operation":"updated","data":{"id":6450,"name":"Contract_Junseob_Kim*_Un. 230.1 \/ Yacht bay, apt. 504_30.09.2025","number":"","start_date":"2025-05-31T00:00:00","end_date":"2025-10-30T00:00:00","external_id":"6124","created_at":"2025-09-28T10:52:29.163380Z","updated_at":"2025-10-07T13:22:23.997622Z","unit_usage":{"usage_id":17666,"client_id":11883,"unit_id":1772,"client_type":"tenant","is_archived":false},"price":"6800.00","contract_scan":null,"co_tenant":"","co_tenant_id_scan":null,"history":"1. Contract from 31.05.2025 to 30.10.2025","type_contract":"Long-term 3+ months","co_tenant_id":""}}}
{"bitrix_id":"6120","ts":"2025-10-07T16:22:30+03:00","response":{"success":true,"message":"Contract successfully updated in Alma","alma_id":6298,"method":"PATCH","operation":"updated","data":{"id":6298,"name":"Contract_Polina_Golovan_Un. 548.1 \/ BD Standpoint B, apt. 1208_21.09.2025","number":"","start_date":"2025-09-21T00:00:00","end_date":"2025-10-21T00:00:00","external_id":"6120","created_at":"2025-09-21T19:15:54.592765Z","updated_at":"2025-10-07T13:22:30.771695Z","unit_usage":{"usage_id":17501,"client_id":13023,"unit_id":14934,"client_type":"tenant","is_archived":false},"price":"8900.00","contract_scan":null,"co_tenant":"","co_tenant_id_scan":null,"history":"","type_contract":"Short term from 1 to 3 months","co_tenant_id":""}}}
{"bitrix_id":"6118","ts":"2025-10-07T16:22:32+03:00","response":[2025-10-07 13:22:32] [ERROR] Unexpected error in contract synchronization: Contract synchronization failed: API request failed (400): {&quot;non_field_errors&quot;:[&quot;There are intersections in the use of the unit. Nearest intersection usage id:17500 usage type=tenant.&quot;]}<br>
{"success":false,"message":"Unexpected error: Contract synchronization failed"}}
{"bitrix_id":"6116","ts":"2025-10-07T16:22:34+03:00","response":{"success":true,"message":"Contract successfully updated in Alma","alma_id":6297,"method":"PATCH","operation":"updated","data":{"id":6297,"name":"Contract_Sanaya_Sanghvi_Un. 95.1 \/ Mag218, apt. 5108_26.09.2025","number":"","start_date":"2025-09-26T00:00:00","end_date":"2025-11-06T00:00:00","external_id":"6116","created_at":"2025-09-21T18:37:42.173875Z","updated_at":"2025-10-07T13:22:34.097401Z","unit_usage":{"usage_id":17500,"client_id":13022,"unit_id":1898,"client_type":"tenant","is_archived":false},"price":"13115.00","contract_scan":null,"co_tenant":"","co_tenant_id_scan":null,"history":"","type_contract":"Short term from 1 to 3 months","co_tenant_id":""}}}
{"bitrix_id":"6108","ts":"2025-10-07T16:22:35+03:00","response":{"success":true,"message":"Contract successfully updated in Alma","alma_id":6295,"method":"PATCH","operation":"updated","data":{"id":6295,"name":"Contract_Belu_Torres_Un. 172.1 \/ Bay Central 1, apt. 3102_22.09.2025","number":"","start_date":"2025-09-22T00:00:00","end_date":"2025-11-05T00:00:00","external_id":"6108","created_at":"2025-09-20T18:56:54.847748Z","updated_at":"2025-10-07T13:22:35.739301Z","unit_usage":{"usage_id":17497,"client_id":13021,"unit_id":1828,"client_type":"tenant","is_archived":false},"price":"10575.00","contract_scan":null,"co_tenant":"","co_tenant_id_scan":null,"history":"","type_contract":"Short term from 1 to 3 months","co_tenant_id":""}}}
{"bitrix_id":"6096","ts":"2025-10-07T16:22:37+03:00","response":{"success":true,"message":"Contract successfully updated in Alma","alma_id":6370,"method":"PATCH","operation":"updated","data":{"id":6370,"name":"Contract_Kiran_Anjum_Un. 39.1 \/ Dubai Gate 1, apt. 210_21.09.2025","number":"","start_date":"2025-06-21T00:00:00","end_date":"2025-10-21T00:00:00","external_id":"6096","created_at":"2025-09-22T13:34:33.872562Z","updated_at":"2025-10-07T13:22:37.371427Z","unit_usage":{"usage_id":17573,"client_id":12023,"unit_id":1960,"client_type":"tenant","is_archived":false},"price":"6399.00","contract_scan":null,"co_tenant":"","co_tenant_id_scan":null,"history":"1. Contract from 21.06.2025 to 21.10.2025","type_contract":"Short term from 1 to 3 months","co_tenant_id":""}}}
{"bitrix_id":"6094","ts":"2025-10-07T16:22:39+03:00","response":{"success":true,"message":"Contract successfully updated in Alma","alma_id":6294,"method":"PATCH","operation":"updated","data":{"id":6294,"name":"Contract_Alexander_Becker_Un. 82.1 \/ Goldcrest Executive, apt. 2117_30.09.2025","number":"","start_date":"2025-09-30T00:00:00","end_date":"2025-11-13T00:00:00","external_id":"6094","created_at":"2025-09-20T14:31:34.867949Z","updated_at":"2025-10-07T13:22:39.127443Z","unit_usage":{"usage_id":17496,"client_id":13020,"unit_id":1920,"client_type":"tenant","is_archived":false},"price":"12500.00","contract_scan":null,"co_tenant":"","co_tenant_id_scan":null,"history":"1. Contract from 30.09.2025 to 13.11.2025","type_contract":"Short term from 1 to 3 months","co_tenant_id":""}}}
{"bitrix_id":"6092","ts":"2025-10-07T16:22:40+03:00","response":{"success":true,"message":"Contract successfully updated in Alma","alma_id":6293,"method":"PATCH","operation":"updated","data":{"id":6293,"name":"Contract_\u041c\u0430\u0440\u0442\u0430_\u0414\u0443\u0434\u0447\u0435\u043d\u043a\u043e_Un. 266.1 \/ No.9, apt. 205_20.09.2025","number":"","start_date":"2024-09-20T00:00:00","end_date":"2026-09-20T00:00:00","external_id":"6092","created_at":"2025-09-20T11:29:10.067793Z","updated_at":"2025-10-07T13:22:40.866211Z","unit_usage":{"usage_id":17495,"client_id":11765,"unit_id":1754,"client_type":"tenant","is_archived":false},"price":"12500.00","contract_scan":null,"co_tenant":"","co_tenant_id_scan":null,"history":"1. Contract from 20.09.2024 to 20.09.2026","type_contract":"Long-term 3+ months","co_tenant_id":""}}}
{"bitrix_id":"6086","ts":"2025-10-07T16:22:42+03:00","response":{"success":true,"message":"Contract successfully updated in Alma","alma_id":6302,"method":"PATCH","operation":"updated","data":{"id":6302,"name":"Contract_Hazem_Farrag_Un. 728.1 \/ HAMILTON RESIDENCY, apt. 204_24.09.2025","number":"","start_date":"2025-09-24T00:00:00","end_date":"2025-10-24T00:00:00","external_id":"6086","created_at":"2025-09-22T07:01:52.457568Z","updated_at":"2025-10-07T13:22:42.613048Z","unit_usage":{"usage_id":17505,"client_id":13019,"unit_id":15428,"client_type":"tenant","is_archived":false},"price":"8000.00","contract_scan":null,"co_tenant":"","co_tenant_id_scan":null,"history":"","type_contract":"Short term from 1 to 3 months","co_tenant_id":""}}}
{"bitrix_id":"6080","ts":"2025-10-07T16:22:44+03:00","response":{"success":true,"message":"Contract successfully updated in Alma","alma_id":6289,"method":"PATCH","operation":"updated","data":{"id":6289,"name":"Contract_Kseniia_Kirsanova_Un. 636.1 \/ La Voile - Building 1, apt. 312_17.09.2025","number":"","start_date":"2025-08-17T00:00:00","end_date":"2025-10-17T00:00:00","external_id":"6080","created_at":"2025-09-19T14:44:23.580841Z","updated_at":"2025-10-07T13:22:44.212406Z","unit_usage":{"usage_id":17491,"client_id":12377,"unit_id":15301,"client_type":"tenant","is_archived":false},"price":"11699.00","contract_scan":null,"co_tenant":"","co_tenant_id_scan":null,"history":"","type_contract":"Short contract up to 1 month","co_tenant_id":""}}}
{"bitrix_id":"6078","ts":"2025-10-07T16:22:45+03:00","response":{"success":true,"message":"Contract successfully updated in Alma","alma_id":6288,"method":"PATCH","operation":"updated","data":{"id":6288,"name":"Contract_No name_name_Un. 59.2-2 \/ Up tower, apt. 2206_28.09.2025","number":"","start_date":"2025-09-28T00:00:00","end_date":"2026-09-28T00:00:00","external_id":"6078","created_at":"2025-09-19T14:19:22.315438Z","updated_at":"2025-10-07T13:22:45.920025Z","unit_usage":{"usage_id":17490,"client_id":13018,"unit_id":2318,"client_type":"tenant","is_archived":false},"price":"3199.00","contract_scan":null,"co_tenant":"","co_tenant_id_scan":null,"history":"","type_contract":"Long-term 3+ months","co_tenant_id":""}}}
{"bitrix_id":"6076","ts":"2025-10-07T16:22:47+03:00","response":{"success":true,"message":"Contract successfully updated in Alma","alma_id":6284,"method":"PATCH","operation":"updated","data":{"id":6284,"name":"Contract_Macy_Ellis Gill_Un. 168.1 \/ Panoramic, apt. 6007_17.09.2025","number":"","start_date":"2025-06-17T00:00:00","end_date":"2025-11-17T00:00:00","external_id":"6076","created_at":"2025-09-19T13:19:37.909166Z","updated_at":"2025-10-07T13:22:47.619516Z","unit_usage":{"usage_id":17486,"client_id":12072,"unit_id":1835,"client_type":"tenant","is_archived":false},"price":"6099.00","contract_scan":null,"co_tenant":"","co_tenant_id_scan":null,"history":"1. Contract from 17.06.2025 to 17.11.2025","type_contract":"Short term from 1 to 3 months","co_tenant_id":""}}}
{"bitrix_id":"6074","ts":"2025-10-07T16:22:49+03:00","response":{"success":true,"message":"Contract successfully updated in Alma","alma_id":6283,"method":"PATCH","operation":"updated","data":{"id":6283,"name":"Contract_Juan Antonio_Nogales Galan_Un. 355.4 \/ Shams 4, apt. 402_17.09.2025","number":"","start_date":"2025-03-17T00:00:00","end_date":"2026-09-17T00:00:00","external_id":"6074","created_at":"2025-09-19T13:16:08.042805Z","updated_at":"2025-10-07T13:22:49.296376Z","unit_usage":{"usage_id":17485,"client_id":11551,"unit_id":2004,"client_type":"tenant","is_archived":false},"price":"5000.00","contract_scan":null,"co_tenant":"","co_tenant_id_scan":null,"history":"1. Contract from 17.03.2025 to 17.09.2026","type_contract":"Long-term 3+ months","co_tenant_id":""}}}
{"bitrix_id":"6070","ts":"2025-10-07T16:22:51+03:00","response":{"success":true,"message":"Contract successfully updated in Alma","alma_id":6282,"method":"PATCH","operation":"updated","data":{"id":6282,"name":"Contract_Olga_Samoilova__22.09.2025","number":"","start_date":"2025-09-27T00:00:00","end_date":"2025-11-27T00:00:00","external_id":"6070","created_at":"2025-09-19T12:21:52.346294Z","updated_at":"2025-10-07T13:22:51.027344Z","unit_usage":{"usage_id":17484,"client_id":2056,"unit_id":15348,"client_type":"tenant","is_archived":false},"price":"10900.00","contract_scan":null,"co_tenant":"","co_tenant_id_scan":null,"history":"","type_contract":"Short contract up to 1 month","co_tenant_id":""}}}
{"bitrix_id":"6062","ts":"2025-10-07T16:22:52+03:00","response":{"success":true,"message":"Contract successfully updated in Alma","alma_id":6274,"method":"PATCH","operation":"updated","data":{"id":6274,"name":"Contract_No name_Isakova_Un. 305.1 \/ Starz Tower 1, apt. 203_19.09.2025","number":"","start_date":"2025-09-19T00:00:00","end_date":"2025-10-19T00:00:00","external_id":"6062","created_at":"2025-09-19T08:58:32.835589Z","updated_at":"2025-10-07T13:22:52.750237Z","unit_usage":{"usage_id":17473,"client_id":13006,"unit_id":1703,"client_type":"tenant","is_archived":false},"price":"7000.00","contract_scan":null,"co_tenant":"","co_tenant_id_scan":null,"history":"","type_contract":"Short term from 1 to 3 months","co_tenant_id":""}}}
{"bitrix_id":"6060","ts":"2025-10-07T16:22:54+03:00","response":{"success":true,"message":"Contract successfully updated in Alma","alma_id":6268,"method":"PATCH","operation":"updated","data":{"id":6268,"name":"Contract_Lost lead for the call from 00989192227136 by Call__Un. 130.1 \/ Discovery Gardens 91, apt. 511_04.10.2025","number":"","start_date":"2025-10-04T00:00:00","end_date":"2025-11-01T00:00:00","external_id":"6060","created_at":"2025-09-19T08:58:32.835589Z","updated_at":"2025-10-07T13:22:54.843927Z","unit_usage":{"usage_id":17466,"client_id":13004,"unit_id":1872,"client_type":"tenant","is_archived":false},"price":"6720.00","contract_scan":null,"co_tenant":"","co_tenant_id_scan":null,"history":"","type_contract":"Less than a month","co_tenant_id":""}}}
{"bitrix_id":"6050","ts":"2025-10-07T16:22:56+03:00","response":{"success":true,"message":"Contract successfully updated in Alma","alma_id":6258,"method":"PATCH","operation":"updated","data":{"id":6258,"name":"Contract_Orkhan_Abbasov_Un. 542.1 \/ Park Heights, apt. 302_16.09.2025","number":"","start_date":"2025-06-16T00:00:00","end_date":"2026-02-16T00:00:00","external_id":"6050","created_at":"2025-09-19T08:58:32.835589Z","updated_at":"2025-10-07T13:22:56.520564Z","unit_usage":{"usage_id":17451,"client_id":11880,"unit_id":9307,"client_type":"tenant","is_archived":false},"price":"10000.00","contract_scan":null,"co_tenant":"","co_tenant_id_scan":null,"history":"1. Contract from 16.06.2025 to 16.02.2026","type_contract":"Short term from 1 to 3 months","co_tenant_id":""}}}
{"bitrix_id":"6048","ts":"2025-10-07T16:22:58+03:00","response":{"success":true,"message":"Contract successfully updated in Alma","alma_id":6250,"method":"PATCH","operation":"updated","data":{"id":6250,"name":"Contract_Daisy_Mawson_Un. 40.1 \/ Marina View, apt. 6\/604_18.09.2025","number":"","start_date":"2025-09-18T00:00:00","end_date":"2026-09-18T00:00:00","external_id":"6048","created_at":"2025-09-19T08:58:32.835589Z","updated_at":"2025-10-07T13:22:58.168129Z","unit_usage":{"usage_id":17443,"client_id":12989,"unit_id":1961,"client_type":"tenant","is_archived":false},"price":"13000.00","contract_scan":null,"co_tenant":"","co_tenant_id_scan":null,"history":"","type_contract":"Long-term 3+ months","co_tenant_id":""}}}
{"bitrix_id":"6046","ts":"2025-10-07T16:22:59+03:00","response":[2025-10-07 13:22:59] [ERROR] Failed to create contract: API request failed (400): {&quot;non_field_errors&quot;:[&quot;There are intersections in the use of the unit. Nearest intersection usage id:17442 usage type=tenant.&quot;]}<br>
[2025-10-07 13:22:59] [ERROR] Unexpected error in contract synchronization: Contract synchronization failed: API request failed (400): {&quot;non_field_errors&quot;:[&quot;There are intersections in the use of the unit. Nearest intersection usage id:17442 usage type=tenant.&quot;]}<br>
{"success":false,"message":"Unexpected error: Contract synchronization failed"}}
{"bitrix_id":"6038","ts":"2025-10-07T16:23:01+03:00","response":[2025-10-07 13:23:01] [ERROR] Failed to create contract: API request failed (400): {&quot;non_field_errors&quot;:[&quot;There are intersections in the use of the unit. Nearest intersection usage id:17108 usage type=tenant.&quot;]}<br>
[2025-10-07 13:23:01] [ERROR] Unexpected error in contract synchronization: Contract synchronization failed: API request failed (400): {&quot;non_field_errors&quot;:[&quot;There are intersections in the use of the unit. Nearest intersection usage id:17108 usage type=tenant.&quot;]}<br>
{"success":false,"message":"Unexpected error: Contract synchronization failed"}}
{"bitrix_id":"6036","ts":"2025-10-07T16:23:03+03:00","response":{"success":true,"message":"Contract successfully updated in Alma","alma_id":6240,"method":"PATCH","operation":"updated","data":{"id":6240,"name":"Contract_Naila_Soobhany_Un. 164.1 \/ Azizi Samia, apt. 621_30.09.2025","number":"","start_date":"2025-09-30T00:00:00","end_date":"2025-10-30T00:00:00","external_id":"6036","created_at":"2025-09-19T08:58:32.835589Z","updated_at":"2025-10-07T13:23:03.067119Z","unit_usage":{"usage_id":17430,"client_id":12984,"unit_id":1838,"client_type":"tenant","is_archived":false},"price":"6999.00","contract_scan":null,"co_tenant":"","co_tenant_id_scan":null,"history":"","type_contract":"Short term from 1 to 3 months","co_tenant_id":""}}}
{"bitrix_id":"6028","ts":"2025-10-07T16:23:04+03:00","response":{"success":true,"message":"Contract successfully updated in Alma","alma_id":6245,"method":"PATCH","operation":"updated","data":{"id":6245,"name":"Contract_Irina__Un. 200.1 \/ AG Tower, apt. 1109B_30.09.2025","number":"","start_date":"2025-10-02T00:00:00","end_date":"2025-12-31T00:00:00","external_id":"6028","created_at":"2025-09-19T08:58:32.835589Z","updated_at":"2025-10-07T13:23:04.776705Z","unit_usage":{"usage_id":17437,"client_id":12981,"unit_id":1806,"client_type":"tenant","is_archived":false},"price":"9500.00","contract_scan":null,"co_tenant":"","co_tenant_id_scan":null,"history":"1. Contract from 02.10.2025 to 31.12.2025","type_contract":"Short term from 1 to 3 months","co_tenant_id":""}}}
{"bitrix_id":"6026","ts":"2025-10-07T16:23:06+03:00","response":[2025-10-07 13:23:06] [ERROR] Failed to create contract: API request failed (400): {&quot;non_field_errors&quot;:[&quot;There are intersections in the use of the unit. Nearest intersection usage id:17393 usage type=tenant.&quot;]}<br>
